"id";"title";"slug";"acronym";"url";"organization";"organization_id";"owner";"owner_id";"description";"description_short";"frequency";"license";"temporal_coverage.start";"temporal_coverage.end";"spatial.granularity";"spatial.zones";"featured";"created_at";"last_modified";"tags";"archived";"resources_count";"main_resources_count";"resources_formats";"harvest.backend";"harvest.domain";"harvest.created_at";"harvest.modified_at";"harvest.remote_url";"quality_score";"metric.discussions";"metric.discussions_open";"metric.reuses";"metric.reuses_by_months";"metric.dataservices";"metric.followers";"metric.followers_by_months";"metric.views";"metric.resources_downloads"
"63e235d52875d95fd7c1b0fe";"Tempêtes et Submersions historiques";"tempetes-et-submersions-historiques";"BDDTSH";"https://www.data.gouv.fr/datasets/tempetes-et-submersions-historiques";"Autorité de sûreté nucléaire et de radioprotection";"539ef743a3a72946de9ebe28";"";"";"Lors des journées REFMAR 2016, l’intérêt d’un groupe de travail (GT <http://refmar.shom.fr/evenements_remarquables/gt_tsh>) pluridisciplinaire sur le sujet des submersions et tempêtes historiques a été souligné. Depuis, ingénieurs, chercheurs, statisticiens et historiens appartenant à différents organismes (ASNR, EDF, Shom, BRGM, ARTELIA, UPLC 17, CEREMA, LIENSs) se réunissent au sein du groupe de travail « Tempêtes et Submersions historiques » (GT) dans le but de mutualiser les informations de tempêtes et submersions historiques au sein notamment d’une base de données commune. La base de données développée par l’ASNR a été retenue par les membres du GT comme un outil de mutualisation des apports de chacun. L’ASNR assure dans un premier temps la gestion et la maintenance de la base ainsi que l’organisation du GT.
La base de données BDDTSH (Base De Données Tempêtes et Submersions Historiques) recense tout type de documents relatifs à des tempêtes ou des submersions historiques sur le littoral Manche et Atlantique et permet d’extraire rapidement les niveaux d’eau ou impacts mentionnés dans les sources.  Les données disponibles dans la base sont entièrement publiques, la BD Tempêtes et Submersions historiques est soumise à la licence open source. La base de données recense plus de 800 événements en janvier 2021.
Une interface graphique est également mise à disposition afin de consulter ces données sur [bddtsh.asnr.fr](https://bddtsh.asnr.fr)&#x20;
Le fichier CSV mis à disposition est une synthèse des données visibles sur le site.
Le dump de la base de données développée sous PostgreSQL 12.x présente les données complètes. Le rapport support à l’installation et l’utilisation de la base de données (Rapport TEMPETES ET SUBMERSIONS HISTORIQUES) est disponible au téléchargement à partir de cette page : <https://recherche-expertise.asnr.fr/recherche/bureau-dexpertise-hydrogeologie-sur-risques-dinondation-meteorologiques-geotechniques-behrig>
";"";"irregular";"Licence Ouverte / Open Licence version 2.0";"1507-01-01";"2016-01-11";"poi";"France métropolitaine";False;"2023-02-07T12:28:21.435000";"2025-09-30T12:59:57.373000";"";False;2;2;"sql,csv";"";"";"";"";"";"1.00";0;0;0;"{'2025-01': 0, '2025-02': 0, '2025-03': 0, '2025-04': 0, '2025-05': 0, '2025-06': 0, '2025-07': 0, '2025-08': 0, '2025-09': 0, '2025-10': 0, '2025-11': 0, '2025-12': 0, '2026-01': 0}";1;0;"{'2025-01': 0, '2025-02': 0, '2025-03': 0, '2025-04': 0, '2025-05': 0, '2025-06': 0, '2025-07': 0, '2025-08': 0, '2025-09': 0, '2025-10': 0, '2025-11': 0, '2025-12': 0, '2026-01': 0}";5260;669
"63e22c42d9bca63e001adb9a";"Infrastructure de recharge";"infrastructure-de-recharge";"GAGNERAUD Salon";"https://www.data.gouv.fr/datasets/infrastructure-de-recharge";"";"";"bertrand-rochefort";"620e36babe85a15aa07a572c";"Borne de recharge de véhicules électriques accessible au public";"";"unknown";"License Not Specified";"";"";"";"";False;"2023-02-07T11:47:30.131000";"2024-12-06T06:50:37.890000";"";False;1;1;"csv";"";"";"";"";"";"0.33";0;0;0;"{'2025-01': 0, '2025-02': 0, '2025-03': 0, '2025-04': 0, '2025-05': 0, '2025-06': 0, '2025-07': 0, '2025-08': 0, '2025-09': 0, '2025-10': 0, '2025-11': 0, '2025-12': 0, '2026-01': 0}";1;0;"{'2025-01': 0, '2025-02': 0, '2025-03': 0, '2025-04': 0, '2025-05': 0, '2025-06': 0, '2025-07': 0, '2025-08': 0, '2025-09': 0, '2025-10': 0, '2025-11': 0, '2025-12': 0, '2026-01': 0}";1725;1531
"63e2245c787ee9914394558c";"Commune de Montans | Document d'urbanisme";"commune-de-montans-document-durbanisme";"";"https://www.data.gouv.fr/datasets/commune-de-montans-document-durbanisme";"Communauté d'Agglomération Gaillac Graulhet";"5ee28a82a4726888290c20c4";"";"";"Ce jeu de données informe du droit à bâtir sur la commune de Montans (81171). Il contient les pièces écrites et les données géographiques intégrables dans un SIG numérisées conformément aux prescriptions nationales pour la dématérialisation des documents d'urbanisme.";"";"irregular";"Licence Ouverte / Open Licence version 2.0";"";"";"fr:commune";"";False;"2023-02-07T11:13:48.059000";"2025-08-27T12:12:17.477000";"";False;5;1;"zip";"";"";"";"";"";"0.89";0;0;0;"{'2025-01': 0, '2025-02': 0, '2025-03': 0, '2025-04': 0, '2025-05': 0, '2025-06': 0, '2025-07': 0, '2025-08': 0, '2025-09': 0, '2025-10': 0, '2025-11': 0, '2025-12': 0, '2026-01': 0}";0;0;"{'2025-01': 0, '2025-02': 0, '2025-03': 0, '2025-04': 0, '2025-05': 0, '2025-06': 0, '2025-07': 0, '2025-08': 0, '2025-09': 0, '2025-10': 0, '2025-11': 0, '2025-12': 0, '2026-01': 0}";3114;188
"63e21e7df3e5557f3e5110ca";"France Solar";"france-solar";"IRVE";"https://www.data.gouv.fr/datasets/france-solar";"FRANCE SOLAR";"63e218b47ae2cf566b23c334";"";"";"Borne de recharge pour véhicules électriques";"";"unknown";"License Not Specified";"";"";"";"";False;"2023-02-07T10:48:45.925000";"2023-02-07T10:50:18.197000";"";False;0;0;"";"";"";"";"";"";"0.11";0;0;0;"{'2025-01': 0, '2025-02': 0, '2025-03': 0, '2025-04': 0, '2025-05': 0, '2025-06': 0, '2025-07': 0, '2025-08': 0, '2025-09': 0, '2025-10': 0, '2025-11': 0, '2025-12': 0, '2026-01': 0}";0;0;"{'2025-01': 0, '2025-02': 0, '2025-03': 0, '2025-04': 0, '2025-05': 0, '2025-06': 0, '2025-07': 0, '2025-08': 0, '2025-09': 0, '2025-10': 0, '2025-11': 0, '2025-12': 0, '2026-01': 0}";572;""
"63e1976256b653c03340440d";"Parcs naturels régionaux Région Sud – Patrimoines des randonnées";"parcs-naturels-regionaux-patrimoine-des-randonnees";"";"https://www.data.gouv.fr/datasets/parcs-naturels-regionaux-patrimoine-des-randonnees";"Parcs naturels régionaux de Provence-Alpes-Côte d'Azur";"63d2af46663cff0dff096cf3";"";"";"Patrimoines (POI) associés aux randonnées des parcs naturels régionaux. Jeu de donnée réalisé avec l'outil Geotrek. Ces POI sont publiés sur le site http://www.cheminsdesparcs.fr Champs du jeu de données : * evenement : Identifiant unique du patrimoine * nom : Nom du patrimoine * type : Type du patrimoine * nom_en : Nom en anglais du patrimoine * date_publi : Date de publication du patrimoine * structure : Parc naturel régional (2:Luberon, 3:Camargue, 4:Queyras, 5:Verdon, 6:Alpilles, 7:Baronnies, 8:Préalpes d'Azur)";"";"";"Licence Ouverte / Open Licence version 2.0";"";"";"";"";False;"2019-02-21T00:00:00";"2023-02-07T01:12:18.545000";"geotrek,parc-naturel-regional,patrimoine,pnr,randonnee,touristique";"2025-04-29T00:07:32.291000";2;2;"geojson";"CKAN";"trouver.datasud.fr";"2019-02-21T00:00:00";"";"https://trouver.datasud.fr/dataset/parcs-naturels-regionaux-patrimoine-des-randonnees";"0.33";0;0;0;0;0;0;0;2491;641
"63e197337bda351ea040440d";"Données essentielles marchés 2023";"donnees-essentielles-marches-2023";"";"https://www.data.gouv.fr/datasets/donnees-essentielles-marches-2023";"Département du Gers";"5d2485a58b4c417f5f478a9f";"";"";"Données issues d'une extraction manuelle depuis le site marches-publics.info";"";"";"Licence Ouverte / Open Licence version 2.0";"";"";"";"";False;"2024-01-02T09:21:55";"2024-01-02T09:21:55";"analytique,donnees-essentielles,economie,marches";False;2;2;"json,csv";"DCAT";"data.gers.fr";"";"2024-01-02T09:21:55";"https://data.gers.fr/explore/dataset/donnees-essentielles-marches-2023/";"0.44";0;0;0;"{'2025-01': 0, '2025-02': 0, '2025-03': 0, '2025-04': 0, '2025-05': 0, '2025-06': 0, '2025-07': 0, '2025-08': 0, '2025-09': 0, '2025-10': 0, '2025-11': 0, '2025-12': 0, '2026-01': 0}";2;0;"{'2025-01': 0, '2025-02': 0, '2025-03': 0, '2025-04': 0, '2025-05': 0, '2025-06': 0, '2025-07': 0, '2025-08': 0, '2025-09': 0, '2025-10': 0, '2025-11': 0, '2025-12': 0, '2026-01': 0}";2593;733
"63e19710cb7991374140440d";"Panneaux zone 30";"panneaux-zone-30";"";"https://www.data.gouv.fr/datasets/panneaux-zone-30";"Mairie de Saint-Denis (La Réunion)";"5c050cfb8b4c413be36cb1c3";"";"";"";"";"";"License Not Specified";"";"";"other";"";False;"2023-02-06T00:00:00";"2023-02-06T00:00:00";"geospatial,mobilite,mobilites,saint-denis,territoire,transport,voirie";False;20;20;"txt,web page,xlsx,gdb,csv,arcgis geoservices rest api,kml,geojson,zip,gpkg";"DCAT";"opendata-sig.saintdenis.re";"";"2023-02-06T00:00:00";"https://opendata-sig.saintdenis.re/datasets/393107b2bf9c48caa131b790fada8cae_111";"0.33";0;0;0;"{'2025-01': 0, '2025-02': 0, '2025-03': 0, '2025-04': 0, '2025-05': 0, '2025-06': 0, '2025-07': 0, '2025-08': 0, '2025-09': 0, '2025-10': 0, '2025-11': 0, '2025-12': 0, '2026-01': 0}";1;0;"{'2025-01': 0, '2025-02': 0, '2025-03': 0, '2025-04': 0, '2025-05': 0, '2025-06': 0, '2025-07': 0, '2025-08': 0, '2025-09': 0, '2025-10': 0, '2025-11': 0, '2025-12': 0, '2026-01': 0}";2994;2576
"63e195340c3a78b4f440440d";"Lieux du dispositif Demandez Angela";"lieux-du-dispositif-demandez-angela";"";"https://www.data.gouv.fr/datasets/lieux-du-dispositif-demandez-angela";"Bordeaux Métropole";"5b0d11f688ee382af4b18c95";"";"";"[ ![picto dictionnaire public](/assets/theme_image/dico_big.png) Dictionnaire Public ](https://data.bordeaux-metropole.fr/dicopub/#/dico#sv_angela_p)
Ce jeu de données présente la localisation des partenaires membres du dispositif ""Demandez Angela"", un dispositif qui vise à lutter contre le harcèlement et les violences sexistes et sexuelles dans l'espace public ainsi que le sentiment d'insécurité. Les partenaires sont des établissements privés et publics, de jour et de nuit, qui s'engagent à respecter la charte d'adhésion, à suivre une séquence de sensibilisation sur la prévention des violences sexistes et sexuelles et l'accueil des victimes et à communiquer auprès du public sur leur adhésion.
Ce jeu de données indique le nom du partenaire, son adresse et sa typologie d'ouverture (jour/nuit) ainsi qu'un lien vers sa page Instagram ou à défaut son site web.";"";"";"Licence Ouverte / Open Licence";"";"";"";"";False;"2025-03-26T04:50:06";"2025-03-26T04:50:06";"data-gouv,harcelement,securite,transport,violence,voirie-espaces-publics";"2025-04-09T00:11:04.445000";4;4;"zip,json,csv";"DCAT";"opendata.bordeaux-metropole.fr";"2025-03-26T04:50:06";"2025-03-26T04:50:06";"https://opendata.bordeaux-metropole.fr/explore/dataset/sv_angela_p/";"0.44";0;0;0;0;0;0;0;3897;1325
"63e1177e313ae985c7615a4c";"Borne de recharge Hôtel Les Colonnades";"borne-de-recharge-hotel-les-colonnades";"";"https://www.data.gouv.fr/datasets/borne-de-recharge-hotel-les-colonnades";"";"";"vincent-guibert-1";"63ca647d6420b52d1f91f6c3";"borne de recharge";"";"threeTimesAYear";"License Not Specified";"";"";"";"";False;"2023-02-06T16:06:38.455000";"2023-02-06T16:06:54.767000";"";False;1;1;"csv";"";"";"";"";"";"0.44";0;0;0;"{'2025-01': 0, '2025-02': 0, '2025-03': 0, '2025-04': 0, '2025-05': 0, '2025-06': 0, '2025-07': 0, '2025-08': 0, '2025-09': 0, '2025-10': 0, '2025-11': 0, '2025-12': 0, '2026-01': 0}";0;0;"{'2025-01': 0, '2025-02': 0, '2025-03': 0, '2025-04': 0, '2025-05': 0, '2025-06': 0, '2025-07': 0, '2025-08': 0, '2025-09': 0, '2025-10': 0, '2025-11': 0, '2025-12': 0, '2026-01': 0}";1954;36
"63e111f91169dd4fee82f673";"Part des véhicules à faibles émissions dans le renouvellement d'un parc (organisation GRAND BESANCON METROPOLE)";"part-des-vehicules-a-faibles-emissions-dans-le-renouvellement-dun-parc-organisation-grand-besancon-metropole";"";"https://www.data.gouv.fr/datasets/part-des-vehicules-a-faibles-emissions-dans-le-renouvellement-dun-parc-organisation-grand-besancon-metropole";"";"";"";"";"Ce jeu de données répond au spécifications du schéma ""Part des véhicules à faibles émissions dans le renouvellement d'un parc"" disponible sur le site [schema.data.gouv.fr](https://schema.data.gouv.fr/etalab/schema-vehicules-faibles-emissions-renouvellement-parc)";"";"unknown";"";"";"";"";"";False;"2023-02-06T15:43:05.624000";"2023-02-06T15:43:06.304000";"";False;1;1;"csv";"";"";"";"";"";"0.33";0;0;0;"{'2025-01': 0, '2025-02': 0, '2025-03': 0, '2025-04': 0, '2025-05': 0, '2025-06': 0, '2025-07': 0, '2025-08': 0, '2025-09': 0, '2025-10': 0, '2025-11': 0, '2025-12': 0, '2026-01': 0}";1;0;"{'2025-01': 0, '2025-02': 0, '2025-03': 0, '2025-04': 0, '2025-05': 0, '2025-06': 0, '2025-07': 0, '2025-08': 0, '2025-09': 0, '2025-10': 0, '2025-11': 0, '2025-12': 0, '2026-01': 0}";1766;240
"63e110a93250852c10aa1cd9";"Infrastructures de recharge pour véhicules électriques (organisation LUMI’iN )";"infrastructures-de-recharge-pour-vehicules-electriques-organisation-lumiin-55";"";"https://www.data.gouv.fr/datasets/infrastructures-de-recharge-pour-vehicules-electriques-organisation-lumiin-55";"LUMI’iN ";"60ff29ef6cd3c362767c12b0";"";"";"Ce jeu de données répond au spécifications du schéma ""IRVE statique"" disponible sur le site [schema.data.gouv.fr](https://schema.data.gouv.fr/etalab/schema-irve-statique)";"";"unknown";"Licence Ouverte / Open Licence version 2.0";"";"";"";"";False;"2023-02-06T15:37:29.549000";"2024-12-06T06:50:37.506000";"";False;1;1;"csv";"";"";"";"";"";"0.33";0;0;0;"{'2025-01': 0, '2025-02': 0, '2025-03': 0, '2025-04': 0, '2025-05': 0, '2025-06': 0, '2025-07': 0, '2025-08': 0, '2025-09': 0, '2025-10': 0, '2025-11': 0, '2025-12': 0, '2026-01': 0}";1;0;"{'2025-01': 0, '2025-02': 0, '2025-03': 0, '2025-04': 0, '2025-05': 0, '2025-06': 0, '2025-07': 0, '2025-08': 0, '2025-09': 0, '2025-10': 0, '2025-11': 0, '2025-12': 0, '2026-01': 0}";1520;1550
"63e106877213241dacb76fa8";"Infrastructures de recharge pour véhicules électriques (organisation LUMI’iN )";"infrastructures-de-recharge-pour-vehicules-electriques-organisation-lumiin-54";"";"https://www.data.gouv.fr/datasets/infrastructures-de-recharge-pour-vehicules-electriques-organisation-lumiin-54";"LUMI’iN ";"60ff29ef6cd3c362767c12b0";"";"";"Ce jeu de données répond au spécifications du schéma ""IRVE statique"" disponible sur le site [schema.data.gouv.fr](https://schema.data.gouv.fr/etalab/schema-irve-statique)";"";"unknown";"License Not Specified";"";"";"";"";False;"2023-02-06T14:54:15.608000";"2024-12-06T06:50:37.129000";"";False;1;1;"csv";"";"";"";"";"";"0.33";0;0;0;"{'2025-01': 0, '2025-02': 0, '2025-03': 0, '2025-04': 0, '2025-05': 0, '2025-06': 0, '2025-07': 0, '2025-08': 0, '2025-09': 0, '2025-10': 0, '2025-11': 0, '2025-12': 0, '2026-01': 0}";0;0;"{'2025-01': 0, '2025-02': 0, '2025-03': 0, '2025-04': 0, '2025-05': 0, '2025-06': 0, '2025-07': 0, '2025-08': 0, '2025-09': 0, '2025-10': 0, '2025-11': 0, '2025-12': 0, '2026-01': 0}";1513;1552
"63e0f96d4e6af27037d6995a";"Subventions 2022";"subventions-2022";"";"https://www.data.gouv.fr/datasets/subventions-2022";"Communauté de communes du Pays Mornantais";"5bbdad47634f410fb7e37ca7";"";"";"Etat des subventions versées en 2022";"";"unknown";"License Not Specified";"2022-01-01";"2022-12-31";"";"";False;"2023-02-06T13:58:21.635000";"2023-12-14T15:00:26.424000";"subventions-2022";False;1;1;"xlsx";"";"";"";"";"";"0.33";0;0;0;"{'2025-01': 0, '2025-02': 0, '2025-03': 0, '2025-04': 0, '2025-05': 0, '2025-06': 0, '2025-07': 0, '2025-08': 0, '2025-09': 0, '2025-10': 0, '2025-11': 0, '2025-12': 0, '2026-01': 0}";1;0;"{'2025-01': 0, '2025-02': 0, '2025-03': 0, '2025-04': 0, '2025-05': 0, '2025-06': 0, '2025-07': 0, '2025-08': 0, '2025-09': 0, '2025-10': 0, '2025-11': 0, '2025-12': 0, '2026-01': 0}";2216;328
"63e0e167f288744925981460";"Déclaration du profil d'acheteur";"declaration-du-profil-dacheteur-9";"SDIS DES ALPES-MARITIMES";"https://www.data.gouv.fr/datasets/declaration-du-profil-dacheteur-9";"SERVICE DEPARTEMENTAL D'INCENDIE ET DE SECOURS DES ALPES-MARITIMES";"63e0cf6a6e1f163469278aaf";"";"";"Déclaration du profil d'acheteur";"";"irregular";"License Not Specified";"";"";"";"";False;"2023-02-06T12:15:51.669000";"2023-02-06T12:15:56.325000";"";False;1;1;"csv";"";"";"";"";"";"0.56";0;0;0;"{'2025-01': 0, '2025-02': 0, '2025-03': 0, '2025-04': 0, '2025-05': 0, '2025-06': 0, '2025-07': 0, '2025-08': 0, '2025-09': 0, '2025-10': 0, '2025-11': 0, '2025-12': 0, '2026-01': 0}";0;0;"{'2025-01': 0, '2025-02': 0, '2025-03': 0, '2025-04': 0, '2025-05': 0, '2025-06': 0, '2025-07': 0, '2025-08': 0, '2025-09': 0, '2025-10': 0, '2025-11': 0, '2025-12': 0, '2026-01': 0}";1569;38
"63e0df7707eacf428ed54cd8";"Déclaration du profil d'acheteur";"declaration-du-profil-dacheteur-8";"SDIS DES ALPES-MARITIMES";"https://www.data.gouv.fr/datasets/declaration-du-profil-dacheteur-8";"SERVICE DEPARTEMENTAL D'INCENDIE ET DE SECOURS DES ALPES-MARITIMES";"63e0cf6a6e1f163469278aaf";"";"";"Déclaration du profil d'acheteur";"";"punctual";"License Not Specified";"";"";"";"";False;"2023-02-06T12:07:35.623000";"2023-02-06T12:09:42.129000";"";False;0;0;"";"";"";"";"";"";"0.33";0;0;0;"{'2025-01': 0, '2025-02': 0, '2025-03': 0, '2025-04': 0, '2025-05': 0, '2025-06': 0, '2025-07': 0, '2025-08': 0, '2025-09': 0, '2025-10': 0, '2025-11': 0, '2025-12': 0, '2026-01': 0}";0;0;"{'2025-01': 0, '2025-02': 0, '2025-03': 0, '2025-04': 0, '2025-05': 0, '2025-06': 0, '2025-07': 0, '2025-08': 0, '2025-09': 0, '2025-10': 0, '2025-11': 0, '2025-12': 0, '2026-01': 0}";581;""
"63e0dbb8b2df11c0800462ba";"Évaluation des entités de recherche par le Hcéres";"evaluation-des-entites-de-recherche-par-le-hceres";"";"https://www.data.gouv.fr/datasets/evaluation-des-entites-de-recherche-par-le-hceres";"Haut Conseil de l’évaluation de la recherche et de l’enseignement supérieur";"62de4eeba2b50a3c98bca747";"";"";"Dans le monde de l'enseignement supérieur et de la recherche, le Hcéres évalue en toute indépendance les établissements, leurs regroupements, leur recherche, leurs formations et leurs écoles doctorales pour leur permettre de progresser. Les campagnes d’évaluation suivent un rythme quinquennal, pour être compatible avec les exigences de la politique contractuelle de l’État qui a réparti les établissements concernés en 5 zones géographiques appelées vagues A, B, C, D et E (voir https://www.hceres.fr/fr/les-campagnes-devaluation). 
Ce jeu de données établit la liste des évaluations des entités de recherche, à partir de la campagne d'évaluation 2023-2024. Ces entités recouvrent les unités de recherche, les structures fédératives et les centres d'investigation clinique. Cette liste est établie chaque année, en amont de la campagne d'évaluation, par un dialogue entre le Hcéres et les tutelles des unités de recherche, à savoir des organismes nationaux de recherche et des universités. 
L'évaluation d'une entité de recherche est décrite de la manière suivante.
1/ L'identification de l'entité de recherche par :
- Un identifiant interne Hcéres ;
- son nom ;
- son acronyme ou son sigle ;
- son identifiant dans le répertoire national des structures de recherche (RNSR, cf. https://appliweb.dgri.education.fr/rnsr/) ;
- La ou les grands domaines scientifiques qu'elle étudie (ST pour sciences et technologies, SHS pour sciences humaines et sociales, SVE pour sciences de la vie et de l'environnement) ;
- Son adresse postale.
2/ Son rattachement à une ou plusieurs tutelles. Une tutelle est identifié par : 
   - son nom ;
   - son code UAI (pour unité administrative immatriculée).
3/ L'évaluation proprement dite :
 - Sa vague de contractualisation (A, B, C, D ou E) ;
 - La campagne d'évaluation concernée (par exemple 2023-2024) ;
 - L'URL pointant vers le rapport d'évaluation (le champ reste vide tant que le rapport n'est pas rendu public).
Attention, une unité de recherche apparait autant de fois qu'elle a de tutelles. 
Mise à jour du 17 mai : la version précédente comportait des codes RNSR fictifs, générés par le Hcéres pour les unités n'en disposant pas. Dorénavant, le code RNSR n'est renseigné que pour les unités effectivement référencés. Pour identifier de manière unique chaque unité, même celles ne disposant pas de code RNSR, un identifiant Hcéres est également publié. Il permettra de faire le lien entre plusieurs évaluations de la même unité.
Pour toute question, contactez donnees-ouvertes@hceres.fr";"";"annual";"Licence Ouverte / Open Licence version 2.0";"2023-01-01";"2024-12-31";"fr:commune";"France";False;"2023-02-06T11:51:36.256000";"2024-05-27T08:01:47.569000";"evaluation,recherche,tutelles";False;1;1;"csv";"";"";"";"";"";"0.89";0;0;0;"{'2025-01': 0, '2025-02': 0, '2025-03': 0, '2025-04': 0, '2025-05': 0, '2025-06': 0, '2025-07': 0, '2025-08': 0, '2025-09': 0, '2025-10': 0, '2025-11': 0, '2025-12': 0, '2026-01': 0}";1;0;"{'2025-01': 0, '2025-02': 0, '2025-03': 0, '2025-04': 0, '2025-05': 0, '2025-06': 0, '2025-07': 0, '2025-08': 0, '2025-09': 0, '2025-10': 0, '2025-11': 0, '2025-12': 0, '2026-01': 0}";3242;175
"63e0cba0b328b10951c91147";"Schéma directeur des infrastructures de recharge pour véhicules électriques et hybrides rechargeables (organisation Syndicat Départemental d'Energies du Rhône)";"schema-directeur-des-infrastructures-de-recharge-pour-vehicules-electriques-et-hybrides-rechargeables-organisation-syndicat-departemental-denergies-du-rhone";"";"https://www.data.gouv.fr/datasets/schema-directeur-des-infrastructures-de-recharge-pour-vehicules-electriques-et-hybrides-rechargeables-organisation-syndicat-departemental-denergies-du-rhone";"Syndicat Départemental d'Energies du Rhône";"63e0c04b194551ac6f2d5f48";"";"";"Ce jeu de données répond au spécifications du schéma ""Schéma directeur des infrastructures de recharge pour véhicules électriques et hybrides rechargeables"" disponible sur le site [schema.data.gouv.fr](https://schema.data.gouv.fr/etalab/schema-sdirve)";"";"unknown";"";"";"";"";"";False;"2023-02-06T10:42:56.262000";"2024-01-29T07:15:05.054000";"";False;2;1;"pdf,csv";"";"";"";"";"";"0.44";0;0;0;"{'2025-01': 0, '2025-02': 0, '2025-03': 0, '2025-04': 0, '2025-05': 0, '2025-06': 0, '2025-07': 0, '2025-08': 0, '2025-09': 0, '2025-10': 0, '2025-11': 0, '2025-12': 0, '2026-01': 0}";1;0;"{'2025-01': 0, '2025-02': 0, '2025-03': 0, '2025-04': 0, '2025-05': 0, '2025-06': 0, '2025-07': 0, '2025-08': 0, '2025-09': 0, '2025-10': 0, '2025-11': 0, '2025-12': 0, '2026-01': 0}";1691;728
"63e0bc12aafe96e51fe925f7";"Transurbain (Evreux Portes de Normandie)";"transurbain-evreux-portes-de-normandie";"";"https://www.data.gouv.fr/datasets/transurbain-evreux-portes-de-normandie";"Syndicat mixte Atoumod";"5cc844dd634f41078d8e2c8e";"";"";"Le jeu de données du réseau de transports publics de l’Agglomération Évreux Portes de Normandie nommé Transurbain. 
Ces données comportent l'intégralité des lignes régulières du réseau, soit les lignes allant de T1 à T10.";"";"semiannual";"Licence Ouverte / Open Licence version 2.0";"2024-08-26";"2025-01-05";"fr:epci";"Evreux Portes de Normandie,Angerville-la-Campagne,Arnières-sur-Iton,Aviron,Évreux,Gravigny,Guichainville,Normanville,Parville,Saint-Sébastien-de-Morsent";False;"2023-02-06T09:36:34.370000";"2026-01-05T21:06:15.087000";"reseau-de-transport,reseaux-de-transport,transport,transport-en-commun,transports-en-commun";False;4;4;"zip,gtfs-rt";"";"";"";"";"";"1.00";4;0;4;"{'2025-01': 0, '2025-02': 0, '2025-03': 0, '2025-04': 1, '2025-05': 0, '2025-06': 0, '2025-07': 0, '2025-08': 0, '2025-09': 0, '2025-10': 0, '2025-11': 0, '2025-12': 0, '2026-01': 0}";0;1;"{'2025-01': 0, '2025-02': 0, '2025-03': 0, '2025-04': 0, '2025-05': 0, '2025-06': 0, '2025-07': 0, '2025-08': 0, '2025-09': 0, '2025-10': 0, '2025-11': 0, '2025-12': 0, '2026-01': 0}";4483;88829
"63e0b476e1e3012d9bada474";"GIP BIHAN";"gip-bihan";"";"https://www.data.gouv.fr/datasets/gip-bihan";"GIP BIHAN";"63e0b1a9516b508d3f4f4b27";"";"";"Blanchisserie inter hospitalière";"";"punctual";"License Not Specified";"";"";"";"";False;"2023-02-06T09:04:06.633000";"2023-02-06T09:04:36.756000";"";False;1;1;"csv";"";"";"";"";"";"0.56";0;0;0;"{'2025-01': 0, '2025-02': 0, '2025-03': 0, '2025-04': 0, '2025-05': 0, '2025-06': 0, '2025-07': 0, '2025-08': 0, '2025-09': 0, '2025-10': 0, '2025-11': 0, '2025-12': 0, '2026-01': 0}";1;0;"{'2025-01': 0, '2025-02': 0, '2025-03': 0, '2025-04': 0, '2025-05': 0, '2025-06': 0, '2025-07': 0, '2025-08': 0, '2025-09': 0, '2025-10': 0, '2025-11': 0, '2025-12': 0, '2026-01': 0}";2244;49
