"id";"title";"slug";"acronym";"url";"organization";"organization_id";"owner";"owner_id";"description";"description_short";"frequency";"license";"temporal_coverage.start";"temporal_coverage.end";"spatial.granularity";"spatial.zones";"featured";"created_at";"last_modified";"tags";"archived";"resources_count";"main_resources_count";"resources_formats";"harvest.backend";"harvest.domain";"harvest.created_at";"harvest.modified_at";"harvest.remote_url";"quality_score";"metric.discussions";"metric.discussions_open";"metric.reuses";"metric.reuses_by_months";"metric.dataservices";"metric.followers";"metric.followers_by_months";"metric.views";"metric.resources_downloads"
"660bf6acf80427f53a00c511";"Cours d'eau du Cantal";"cours-deau-du-cantal";"";"https://www.data.gouv.fr/datasets/cours-deau-du-cantal";"Direction Départementale et des Territoires du Cantal";"558ad939c751df7c4fa453bc";"";"";"La loi pour la reconquête de la biodiversité, de la nature et des paysages, publiée au Journal officiel du 9 août 2016, définit la notion de cours d’eau. Afin de mieux faire connaître les parties du réseau hydrographique qui doivent être considérées comme des cours d’eau, les services de l’Etat ont établi, sur la base d’une méthodologie d’identification concertée, une cartographie des écoulements déjà connus dans le département du Cantal en déterminant, lorsque les éléments d’analyse disponibles sont suffisants, leur statut au regard de la loi sur l’eau, et dans le cas contraire, en précisant les modalités à mettre en œuvre pour permettre éventuellement de les caractériser.";"";"";"Licence Ouverte / Open Licence version 2.0";"";"";"other";"";False;"2019-07-09T00:00:00";"2019-10-19T00:00:00";"cours-deau,donnees-ouvertes,hydrographie,zones-de-gestion-de-restriction-ou-de-reglementation-et-unites-de-declaration";"2025-07-17T02:20:23.544000";6;2;"n69a84bcd4302437ba98ca0ed16de45b4,n6d903c482a804c4b908dcf6ca89e204a,n9f13120be0c74d3b8bfdd3e9b2b68321,nbc204e5482f2470aa1004637914c6fef,n5cf4ee0d160443098549c8cb6eb7eb0e,n3f0c2c3cb3ed4f6994e201ea76163fdf";"CSW-ISO-19139";"ogc.geo-ide.developpement-durable.gouv.fr";"2019-07-09T00:00:00";"2019-10-19T00:00:00";"http://catalogue.geo-ide.developpement-durable.gouv.fr/catalogue/srv/fre/catalog.search#/metadata/fr-120066022-jdd-3d069dde-c9d6-43aa-9817-c8bfeec88295";"0.56";0;0;0;"{'2024-07': 0, '2024-08': 0, '2024-09': 0, '2024-10': 0, '2024-11': 0, '2024-12': 0, '2025-01': 0, '2025-02': 0, '2025-03': 0, '2025-04': 0, '2025-05': 0, '2025-06': 0, '2025-07': 0}";0;0;0;592;168
"660bf6ac955b07e38183d686";"Petite Région Agricole (PRA) du Cantal";"petite-region-agricole-pra-du-cantal";"";"https://www.data.gouv.fr/datasets/petite-region-agricole-pra-du-cantal";"Direction Départementale et des Territoires du Cantal";"558ad939c751df7c4fa453bc";"";"";"Les régions agricoles et petites régions agricoles ont été définies (en 1946) pour mettre en évidence des zones agricoles homogènes. La Région Agricole (RA) couvre un nombre entier de communes formant une zone d'agriculture homogène. La Petite Région Agricole (PRA) est constituée par le croisement du département et de la RA.La dernière actualisation date de 1981.";"";"";"Licence Ouverte / Open Licence version 2.0";"";"";"other";"";False;"2019-07-10T00:00:00";"2017-04-27T00:00:00";"agriculture-zonages-agricoles,donnees-ouvertes";False;6;2;"esri shapefile (shp)";"CSW-ISO-19139";"ogc.geo-ide.developpement-durable.gouv.fr";"1981-01-01T00:00:00";"2017-04-27T00:00:00";"http://catalogue.geo-ide.developpement-durable.gouv.fr/catalogue/srv/fre/catalog.search#/metadata/fr-120066022-jdd-f80cdd97-ac62-4ed6-9a53-1eed6c4217e1";"0.56";0;0;0;"{'2025-01': 0, '2025-02': 0, '2025-03': 0, '2025-04': 0, '2025-05': 0, '2025-06': 0, '2025-07': 0, '2025-08': 0, '2025-09': 0, '2025-10': 0, '2025-11': 0, '2025-12': 0, '2026-01': 0}";0;0;"{'2025-01': 0, '2025-02': 0, '2025-03': 0, '2025-04': 0, '2025-05': 0, '2025-06': 0, '2025-07': 0, '2025-08': 0, '2025-09': 0, '2025-10': 0, '2025-11': 0, '2025-12': 0, '2026-01': 0}";728;270
"660bf6acb0fdea435300c511";"Zone agricole défavorisée infracommunale dans le Cantal";"zone-agricole-defavorisee-infracommunale-dans-le-cantal";"";"https://www.data.gouv.fr/datasets/zone-agricole-defavorisee-infracommunale-dans-le-cantal";"Direction Départementale et des Territoires du Cantal";"558ad939c751df7c4fa453bc";"";"";"Les zones agricoles défavorisées (terminologie française) sont des zones soumises à des contraintes naturelles ou spécifiques dans lesquelles la production agricole est considérée comme plus difficile. Dans ces zones, les agriculteurs sont éligibles à des aides compensatoires de l’Union européenne liées à ces handicaps.
Selon la réglementation européenne, on distingue actuellement 3 types de zones agricoles défavorisées :
    les zones de montagne ;
    les zones soumises à des contraintes naturelles importantes (ZSCN) ;
    les zones soumises à des contraintes spécifiques (ZSCS).
ZSCN et ZSCS sont les zones hors montagne, elles sont appelées historiquement « zones défavorisées simples » ou ZDS.
La distinction entre ZSCS et ZSCN est uniquement d’ordre réglementaire, elle n’a pas de conséquence en matière d’attribution des aides.
L’unité de base pour la délimitation est la commune.
Une nouvelle délimitation des zones défavorisées entre en vigueur  en 2019
Pour faire suite au décret n° 2019-243 du 27 mars 2019 relatif à la révision des critères de délimitation des zones agricoles défavorisées autres que les zones de montagne modifiant le code rural et à l'arrêté du 27 mars 2019 portant délimitation des zones agricoles défavorisées, un arrêté n° 19 - 124 relatif à la délimitation des sous-zones soumises à contraintes naturelles ou spécifiques éligibles au paiement de l'indemnité compensatoire de handicaps naturels de la région Auvergne-Rhône-Alpes a été signé le 2 mai par le Préfet de Région. Vous trouverez en pièce jointe l'arrêté accompagné de son annexe.
Un atlas cartographique des communes à zonage infra-communal a été établi mais est trop volumineux pour vous être transmis (339Mo). Il sera mis en ligne prochainement sur le site de la DRAAF.";"";"";"License Not Specified";"";"";"other";"";False;"2016-07-11T00:00:00";"2019-06-24T00:00:00";"agriculture-zonages-agricoles,inspire,zones-de-gestion-de-restriction-ou-de-reglementation-et-unites-de-declaration";False;6;2;"esri shapefile (shp)";"CSW-ISO-19139";"ogc.geo-ide.developpement-durable.gouv.fr";"2016-08-09T00:00:00";"2019-06-24T00:00:00";"http://catalogue.geo-ide.developpement-durable.gouv.fr/catalogue/srv/fre/catalog.search#/metadata/fr-120066022-jdd-875a640a-ed6c-4b53-9d9b-71715997b71f";"0.56";0;0;0;"{'2025-01': 0, '2025-02': 0, '2025-03': 0, '2025-04': 0, '2025-05': 0, '2025-06': 0, '2025-07': 0, '2025-08': 0, '2025-09': 0, '2025-10': 0, '2025-11': 0, '2025-12': 0, '2026-01': 0}";0;0;"{'2025-01': 0, '2025-02': 0, '2025-03': 0, '2025-04': 0, '2025-05': 0, '2025-06': 0, '2025-07': 0, '2025-08': 0, '2025-09': 0, '2025-10': 0, '2025-11': 0, '2025-12': 0, '2026-01': 0}";288;159
"660bf6acbc82b7fcc900c511";"Repère de nivellement du Cantal";"repere-de-nivellement-du-cantal";"";"https://www.data.gouv.fr/datasets/repere-de-nivellement-du-cantal";"Direction Départementale et des Territoires du Cantal";"558ad939c751df7c4fa453bc";"";"";"Ensemble des repères de Nivellement Général de la France (NGF) sur le département du Cantal.";"";"";"License Not Specified";"";"";"other";"";False;"2014-05-12T00:00:00";"2014-05-12T00:00:00";"";False;2;0;"mapinfo tab";"CSW-ISO-19139";"ogc.geo-ide.developpement-durable.gouv.fr";"2002-10-18T00:00:00";"2014-05-12T00:00:00";"http://catalogue.geo-ide.developpement-durable.gouv.fr/catalogue/srv/fre/catalog.search#/metadata/fr-120066022-jdd-0d236336-7292-45e4-a8eb-54a6ec456fa7";"0.44";0;0;0;"{'2025-01': 0, '2025-02': 0, '2025-03': 0, '2025-04': 0, '2025-05': 0, '2025-06': 0, '2025-07': 0, '2025-08': 0, '2025-09': 0, '2025-10': 0, '2025-11': 0, '2025-12': 0, '2026-01': 0}";0;0;"{'2025-01': 0, '2025-02': 0, '2025-03': 0, '2025-04': 0, '2025-05': 0, '2025-06': 0, '2025-07': 0, '2025-08': 0, '2025-09': 0, '2025-10': 0, '2025-11': 0, '2025-12': 0, '2026-01': 0}";525;66
"660bf6abb0f89b913a00c512";"L_Carrieres_P_015";"l-carrieres-p-015";"";"https://www.data.gouv.fr/datasets/l-carrieres-p-015";"Direction Départementale et des Territoires du Cantal";"558ad939c751df7c4fa453bc";"";"";"L_Carrieres_P_015";"";"";"Licence Ouverte / Open Licence version 2.0";"";"";"other";"";False;"2022-07-04T00:00:00";"2022-05-30T00:00:00";"donnees-ouvertes,site-industriel-production-mine-carriere-granulats";False;6;2;"esri shapefile (shp)";"CSW-ISO-19139";"ogc.geo-ide.developpement-durable.gouv.fr";"2022-05-30T00:00:00";"2022-05-30T00:00:00";"http://catalogue.geo-ide.developpement-durable.gouv.fr/catalogue/srv/fre/catalog.search#/metadata/fr-120066022-jdd-ac748501-de87-4940-8220-77cd1edade67";"0.44";0;0;0;"{'2025-01': 0, '2025-02': 0, '2025-03': 0, '2025-04': 0, '2025-05': 0, '2025-06': 0, '2025-07': 0, '2025-08': 0, '2025-09': 0, '2025-10': 0, '2025-11': 0, '2025-12': 0, '2026-01': 0}";0;0;"{'2025-01': 0, '2025-02': 0, '2025-03': 0, '2025-04': 0, '2025-05': 0, '2025-06': 0, '2025-07': 0, '2025-08': 0, '2025-09': 0, '2025-10': 0, '2025-11': 0, '2025-12': 0, '2026-01': 0}";476;267
"660bf6ab2d9919befc00c512";"N_BCAE9_PRAIRIES_SENSIBLES_S_015";"n-bcae9-prairies-sensibles-s-015";"";"https://www.data.gouv.fr/datasets/n-bcae9-prairies-sensibles-s-015";"Direction Départementale et des Territoires du Cantal";"558ad939c751df7c4fa453bc";"";"";"N_BCAE9_PRAIRIES_SENSIBLES_S_015";"";"";"Licence Ouverte / Open Licence version 2.0";"";"";"other";"";False;"2023-05-04T00:00:00";"2023-05-02T00:00:00";"agriculture-agri-environnement,donnees-ouvertes,inspire,sites-proteges,usage-des-sols";False;6;2;"esri shapefile (shp)";"CSW-ISO-19139";"ogc.geo-ide.developpement-durable.gouv.fr";"2023-05-02T00:00:00";"2023-05-02T00:00:00";"http://catalogue.geo-ide.developpement-durable.gouv.fr/catalogue/srv/fre/catalog.search#/metadata/fr-120066022-jdd-14e2673b-08aa-4072-ab1b-7dc93a9fd7dc";"0.44";0;0;0;"{'2025-01': 0, '2025-02': 0, '2025-03': 0, '2025-04': 0, '2025-05': 0, '2025-06': 0, '2025-07': 0, '2025-08': 0, '2025-09': 0, '2025-10': 0, '2025-11': 0, '2025-12': 0, '2026-01': 0}";0;0;"{'2025-01': 0, '2025-02': 0, '2025-03': 0, '2025-04': 0, '2025-05': 0, '2025-06': 0, '2025-07': 0, '2025-08': 0, '2025-09': 0, '2025-10': 0, '2025-11': 0, '2025-12': 0, '2026-01': 0}";578;292
"660bf6aba9c3b12c3a83d685";"Siège des EPCI";"siege-des-epci-1";"";"https://www.data.gouv.fr/datasets/siege-des-epci-1";"Direction Départementale et des Territoires du Cantal";"558ad939c751df7c4fa453bc";"";"";"Siège des EPCI du Cantal";"";"";"Licence Ouverte / Open Licence version 2.0";"";"";"other";"";False;"2016-10-06T00:00:00";"2017-10-11T00:00:00";"donnee-generique-intercommunalite,donnees-ouvertes";False;6;2;"inconnu";"CSW-ISO-19139";"ogc.geo-ide.developpement-durable.gouv.fr";"2016-10-06T00:00:00";"2017-10-11T00:00:00";"http://catalogue.geo-ide.developpement-durable.gouv.fr/catalogue/srv/fre/catalog.search#/metadata/fr-120066022-jdd-af671075-0d76-4526-8683-fb3eeebd783d";"0.33";0;0;0;"{'2025-01': 0, '2025-02': 0, '2025-03': 0, '2025-04': 0, '2025-05': 0, '2025-06': 0, '2025-07': 0, '2025-08': 0, '2025-09': 0, '2025-10': 0, '2025-11': 0, '2025-12': 0, '2026-01': 0}";0;0;"{'2025-01': 0, '2025-02': 0, '2025-03': 0, '2025-04': 0, '2025-05': 0, '2025-06': 0, '2025-07': 0, '2025-08': 0, '2025-09': 0, '2025-10': 0, '2025-11': 0, '2025-12': 0, '2026-01': 0}";727;213
"660bf6ab955b07e38183d685";"L_EBC_S_015";"l-ebc-s-015";"";"https://www.data.gouv.fr/datasets/l-ebc-s-015";"Direction Départementale et des Territoires du Cantal";"558ad939c751df7c4fa453bc";"";"";"Espaces boisés classés du Cantal";"";"";"Licence Ouverte / Open Licence version 2.0";"";"";"other";"";False;"2022-07-04T00:00:00";"2022-05-30T00:00:00";"amenagement-urbanisme-zonages-planification,donnees-ouvertes,foret-reglement";False;6;2;"esri shapefile (shp)";"CSW-ISO-19139";"ogc.geo-ide.developpement-durable.gouv.fr";"2022-05-30T00:00:00";"2022-05-30T00:00:00";"http://catalogue.geo-ide.developpement-durable.gouv.fr/catalogue/srv/fre/catalog.search#/metadata/fr-120066022-jdd-3b575b5e-88ed-4a02-876e-da74fa28c037";"0.44";0;0;0;"{'2025-01': 0, '2025-02': 0, '2025-03': 0, '2025-04': 0, '2025-05': 0, '2025-06': 0, '2025-07': 0, '2025-08': 0, '2025-09': 0, '2025-10': 0, '2025-11': 0, '2025-12': 0, '2026-01': 0}";0;0;"{'2025-01': 0, '2025-02': 0, '2025-03': 0, '2025-04': 0, '2025-05': 0, '2025-06': 0, '2025-07': 0, '2025-08': 0, '2025-09': 0, '2025-10': 0, '2025-11': 0, '2025-12': 0, '2026-01': 0}";437;267
"660bf6aa955b07e38183d684";"Installations classées soumises à autorisation";"installations-classees-soumises-a-autorisation";"";"https://www.data.gouv.fr/datasets/installations-classees-soumises-a-autorisation";"Direction Départementale et des Territoires du Cantal";"558ad939c751df7c4fa453bc";"";"";"Cette base contient les installations soumises à autorisation ou à enregistrement (en construction, en fonctionnement ou en cessation d'activité). Dernière mise à jour de la base de données :  27/04/2018.";"";"";"Licence Ouverte / Open Licence version 2.0";"";"";"other";"";False;"2022-07-04T00:00:00";"2025-01-08T00:00:00";"classees,donnees-ouvertes,installations,site-industriel-production-site-industriel";False;6;2;"esri shapefile (shp)";"CSW-ISO-19139";"ogc.geo-ide.developpement-durable.gouv.fr";"";"2025-01-08T00:00:00";"http://catalogue.geo-ide.developpement-durable.gouv.fr/catalogue/srv/fre/catalog.search#/metadata/fr-120066022-jdd-6c8fad44-3e4d-4dee-ab0c-e28350489383";"0.56";0;0;0;"{'2025-01': 0, '2025-02': 0, '2025-03': 0, '2025-04': 0, '2025-05': 0, '2025-06': 0, '2025-07': 0, '2025-08': 0, '2025-09': 0, '2025-10': 0, '2025-11': 0, '2025-12': 0, '2026-01': 0}";0;0;"{'2025-01': 0, '2025-02': 0, '2025-03': 0, '2025-04': 0, '2025-05': 0, '2025-06': 0, '2025-07': 0, '2025-08': 0, '2025-09': 0, '2025-10': 0, '2025-11': 0, '2025-12': 0, '2026-01': 0}";806;402
"660bf6aaa9c3b12c3a83d684";"Zone homogène selon des critères agro-climatiques qui conditionnent la production herbagère dans le Cantal";"zone-homogene-selon-des-criteres-agro-climatiques-qui-conditionnent-la-production-herbagere-dans-le-cantal-1";"";"https://www.data.gouv.fr/datasets/zone-homogene-selon-des-criteres-agro-climatiques-qui-conditionnent-la-production-herbagere-dans-le-cantal-1";"Direction Départementale et des Territoires du Cantal";"558ad939c751df7c4fa453bc";"";"";"Zone homogène selon des critères agro-climatiques qui conditionnent la production herbagère.
Ce zonage a été constitué à partir des résultats de l'enquête « prairies » faite par le SCEES en 1982. Il a été déterminé en fonction des critères suivants :
  - climat (en particulier l'hygrométrie)
  - altitude moyenne
  - géologie (nature du sol et du sous-sol)
Elles ont été revues en 1998 afin de travailler sur des zones d'au moins 90 000 hectares. Elles servent de base au système ISOP (Informations et Suivi Objectif des Prairies) qui fournit des estimations de rendement des prairies temporaires et permanentes productives.
Les 228 régions fourragères françaises excluent les départements peu fourragers : l'île de France et le pourtour méditerranéen.";"";"";"Licence Ouverte / Open Licence version 2.0";"";"";"other";"";False;"2016-07-11T00:00:00";"2016-07-11T00:00:00";"agriculture-zonages-agricoles,donnees-ouvertes,inspire,unites-statistiques";False;6;2;"esri shapefile (shp)";"CSW-ISO-19139";"ogc.geo-ide.developpement-durable.gouv.fr";"2011-04-08T00:00:00";"2016-07-11T00:00:00";"http://catalogue.geo-ide.developpement-durable.gouv.fr/catalogue/srv/fre/catalog.search#/metadata/fr-120066022-jdd-4bb1d476-b524-4660-9b02-b51a3463e3d5";"0.56";0;0;0;"{'2025-01': 0, '2025-02': 0, '2025-03': 0, '2025-04': 0, '2025-05': 0, '2025-06': 0, '2025-07': 0, '2025-08': 0, '2025-09': 0, '2025-10': 0, '2025-11': 0, '2025-12': 0, '2026-01': 0}";0;0;"{'2025-01': 0, '2025-02': 0, '2025-03': 0, '2025-04': 0, '2025-05': 0, '2025-06': 0, '2025-07': 0, '2025-08': 0, '2025-09': 0, '2025-10': 0, '2025-11': 0, '2025-12': 0, '2026-01': 0}";505;152
"660bf6aa955b07e38183d683";"L_FORETSRELEVANTDURF_S_015";"l-foretsrelevantdurf-s-015";"";"https://www.data.gouv.fr/datasets/l-foretsrelevantdurf-s-015";"Direction Départementale et des Territoires du Cantal";"558ad939c751df7c4fa453bc";"";"";"Forêts relevant du Régime forestier";"";"";"License Not Specified";"";"";"other";"";False;"2022-07-04T00:00:00";"2022-05-16T00:00:00";"donnees-ouvertes,foret-foret,foret-gestion,foret-reglement";"2024-05-13T09:10:05.638000";0;0;"";"CSW-ISO-19139";"ogc.geo-ide.developpement-durable.gouv.fr";"2022-07-04T00:00:00";"2022-05-16T00:00:00";"";"0.22";0;0;0;0;0;0;0;222;""
"660bf6a9a9c3b12c3a83d683";"Communes disposant d’une réglementation des boisements – Cantal";"communes-disposant-dune-reglementation-des-boisements-cantal-2";"";"https://www.data.gouv.fr/datasets/communes-disposant-dune-reglementation-des-boisements-cantal-2";"Direction Départementale et des Territoires du Cantal";"558ad939c751df7c4fa453bc";"";"";"Identification des communes ayant établi une réglementation des boisements.";"";"";"Licence Ouverte / Open Licence version 2.0";"";"";"other";"";False;"2016-05-12T00:00:00";"2016-05-12T00:00:00";"boisement,donnees-ouvertes,foret-foret,reglement";False;6;2;"esri shapefile (shp)";"CSW-ISO-19139";"ogc.geo-ide.developpement-durable.gouv.fr";"2000-03-20T00:00:00";"2016-05-12T00:00:00";"http://catalogue.geo-ide.developpement-durable.gouv.fr/catalogue/srv/fre/catalog.search#/metadata/fr-120066022-jdd-569f2da2-e165-48c4-a2c8-2fdd18826afa";"0.44";0;0;0;"{'2025-01': 0, '2025-02': 0, '2025-03': 0, '2025-04': 0, '2025-05': 0, '2025-06': 0, '2025-07': 0, '2025-08': 0, '2025-09': 0, '2025-10': 0, '2025-11': 0, '2025-12': 0, '2026-01': 0}";0;0;"{'2025-01': 0, '2025-02': 0, '2025-03': 0, '2025-04': 0, '2025-05': 0, '2025-06': 0, '2025-07': 0, '2025-08': 0, '2025-09': 0, '2025-10': 0, '2025-11': 0, '2025-12': 0, '2026-01': 0}";724;326
"660bf5ca4d69b623e383d684";"Zones de bruit stratégiques de l'Ardèche - 4ème échéance - Carte type C - Indicateur Ln";"zones-de-bruit-strategiques-de-lardeche-4eme-echeance-carte-type-c-indicateur-ln";"";"https://www.data.gouv.fr/datasets/zones-de-bruit-strategiques-de-lardeche-4eme-echeance-carte-type-c-indicateur-ln";"DDT de l'Ardèche";"58837b3b88ee3861af9b81a7";"";"";"Les zones de bruit sont des éléments géométriques constitutifs de la carte de bruit stratégique.
Pour les cartes de type A (CBSTYPE), chaque zone de bruit est généralement délimitée par 2 courbes isophones (Lden 55-60, 60-65, 65-70, 70-75 et Ln 50-55, 55-60, 60-65, 65-70) ou par la courbe isophone de limite inférieure (Lden >75, Ln > 70).
Pour les cartes de type C (CBSTYPE), chaque zone de bruit est délimitée par la courbe isophone de limite inférieure (Lden > 68 ou 73, Ln > 62 ou 65).";"";"";"Licence Ouverte / Open Licence version 2.0";"";"";"other";"";False;"2023-02-17T00:00:00";"2023-02-17T00:00:00";"bruit,directive-2002-49-ce,donnees-ouvertes,environnement,nuisance-bruit,nuisance-n-bruit,sante,zone-de-bruit";False;6;2;"esri shapefile (shp)";"CSW-ISO-19139";"ogc.geo-ide.developpement-durable.gouv.fr";"2023-02-17T00:00:00";"2023-02-17T00:00:00";"http://catalogue.geo-ide.developpement-durable.gouv.fr/catalogue/srv/fre/catalog.search#/metadata/fr-120066022-jdd-6230379e-1ee9-442f-abfb-6028937ef69d";"0.56";0;0;0;"{'2025-01': 0, '2025-02': 0, '2025-03': 0, '2025-04': 0, '2025-05': 0, '2025-06': 0, '2025-07': 0, '2025-08': 0, '2025-09': 0, '2025-10': 0, '2025-11': 0, '2025-12': 0, '2026-01': 0}";0;0;"{'2025-01': 0, '2025-02': 0, '2025-03': 0, '2025-04': 0, '2025-05': 0, '2025-06': 0, '2025-07': 0, '2025-08': 0, '2025-09': 0, '2025-10': 0, '2025-11': 0, '2025-12': 0, '2026-01': 0}";797;399
"660bf5cab0f89b913a00c511";"Zones de bruit stratégiques de l'Ardèche - 4ème échéance - Carte type A - Indicateur Ln";"zones-de-bruit-strategiques-de-lardeche-4eme-echeance-carte-type-a-indicateur-ln";"";"https://www.data.gouv.fr/datasets/zones-de-bruit-strategiques-de-lardeche-4eme-echeance-carte-type-a-indicateur-ln";"DDT de l'Ardèche";"58837b3b88ee3861af9b81a7";"";"";"Les zones de bruit sont des éléments géométriques constitutifs de la carte de bruit stratégique.
Pour les cartes de type A (CBSTYPE), chaque zone de bruit est généralement délimitée par 2 courbes isophones (Lden 55-60, 60-65, 65-70, 70-75 et Ln 50-55, 55-60, 60-65, 65-70) ou par la courbe isophone de limite inférieure (Lden >75, Ln > 70).
Pour les cartes de type C (CBSTYPE), chaque zone de bruit est délimitée par la courbe isophone de limite inférieure (Lden > 68 ou 73, Ln > 62 ou 65).";"";"";"Licence Ouverte / Open Licence version 2.0";"";"";"other";"";False;"2023-02-17T00:00:00";"2023-02-17T00:00:00";"bruit,directive-2002-49-ce,donnees-ouvertes,environnement,nuisance-bruit,nuisance-n-bruit,sante,zone-de-bruit";False;6;2;"esri shapefile (shp)";"CSW-ISO-19139";"ogc.geo-ide.developpement-durable.gouv.fr";"2023-02-17T00:00:00";"2023-02-17T00:00:00";"http://catalogue.geo-ide.developpement-durable.gouv.fr/catalogue/srv/fre/catalog.search#/metadata/fr-120066022-jdd-02082b54-9894-44fa-9e2f-0cbb55866691";"0.56";0;0;0;"{'2025-01': 0, '2025-02': 0, '2025-03': 0, '2025-04': 0, '2025-05': 0, '2025-06': 0, '2025-07': 0, '2025-08': 0, '2025-09': 0, '2025-10': 0, '2025-11': 0, '2025-12': 0, '2026-01': 0}";0;0;"{'2025-01': 0, '2025-02': 0, '2025-03': 0, '2025-04': 0, '2025-05': 0, '2025-06': 0, '2025-07': 0, '2025-08': 0, '2025-09': 0, '2025-10': 0, '2025-11': 0, '2025-12': 0, '2026-01': 0}";611;518
"660bf5ca5c7f98685700c520";"Zones de bruit stratégiques de l'Ardèche - 4ème échéance - Carte type C - Indicateur Lden";"zones-de-bruit-strategiques-de-lardeche-4eme-echeance-carte-type-c-indicateur-lden";"";"https://www.data.gouv.fr/datasets/zones-de-bruit-strategiques-de-lardeche-4eme-echeance-carte-type-c-indicateur-lden";"DDT de l'Ardèche";"58837b3b88ee3861af9b81a7";"";"";"Les zones de bruit sont des éléments géométriques constitutifs de la carte de bruit stratégique.
Pour les cartes de type A (CBSTYPE), chaque zone de bruit est généralement délimitée par 2 courbes isophones (Lden 55-60, 60-65, 65-70, 70-75 et Ln 50-55, 55-60, 60-65, 65-70) ou par la courbe isophone de limite inférieure (Lden >75, Ln > 70).
Pour les cartes de type C (CBSTYPE), chaque zone de bruit est délimitée par la courbe isophone de limite inférieure (Lden > 68 ou 73, Ln > 62 ou 65).";"";"";"Licence Ouverte / Open Licence version 2.0";"";"";"other";"";False;"2023-02-17T00:00:00";"2023-02-17T00:00:00";"bruit,directive-2002-49-ce,donnees-ouvertes,environnement,nuisance-bruit,nuisance-n-bruit,sante,zone-de-bruit";False;6;2;"esri shapefile (shp)";"CSW-ISO-19139";"ogc.geo-ide.developpement-durable.gouv.fr";"2023-02-17T00:00:00";"2023-02-17T00:00:00";"http://catalogue.geo-ide.developpement-durable.gouv.fr/catalogue/srv/fre/catalog.search#/metadata/fr-120066022-jdd-c2992ac0-df2d-44d9-b332-99fc76677bdf";"0.56";0;0;0;"{'2025-01': 0, '2025-02': 0, '2025-03': 0, '2025-04': 0, '2025-05': 0, '2025-06': 0, '2025-07': 0, '2025-08': 0, '2025-09': 0, '2025-10': 0, '2025-11': 0, '2025-12': 0, '2026-01': 0}";0;0;"{'2025-01': 0, '2025-02': 0, '2025-03': 0, '2025-04': 0, '2025-05': 0, '2025-06': 0, '2025-07': 0, '2025-08': 0, '2025-09': 0, '2025-10': 0, '2025-11': 0, '2025-12': 0, '2026-01': 0}";859;461
