"id";"title";"slug";"acronym";"url";"organization";"organization_id";"owner";"owner_id";"description";"description_short";"frequency";"license";"temporal_coverage.start";"temporal_coverage.end";"spatial.granularity";"spatial.zones";"featured";"created_at";"last_modified";"tags";"archived";"resources_count";"main_resources_count";"resources_formats";"harvest.backend";"harvest.domain";"harvest.created_at";"harvest.modified_at";"harvest.remote_url";"quality_score";"metric.discussions";"metric.discussions_open";"metric.reuses";"metric.reuses_by_months";"metric.dataservices";"metric.followers";"metric.followers_by_months";"metric.views";"metric.resources_downloads"
"660bf6bebc82b7fcc900c519";"Natura 2000 - directive oiseaux de Auvergne";"natura-2000-directive-oiseaux-de-auvergne";"";"https://www.data.gouv.fr/datasets/natura-2000-directive-oiseaux-de-auvergne";"Direction Départementale et des Territoires du Cantal";"558ad939c751df7c4fa453bc";"";"";"Le réseau Natura 2000 comprend 2 types de zones réglementaires : les Zones de Protection Spéciale (ZPS) et les Sites d'Intérêt Communautaire (SIC). Les ZPS sont désignées à partir de l'inventaire des Zones Importantes pour la Conservation des Oiseaux (ZICO) définies par la directive européenne 79/409/CEE du 25/4/1979 concernant la conservation des oiseaux sauvages.";"";"";"Licence Ouverte / Open Licence version 2.0";"";"";"other";"";False;"2018-10-04T00:00:00";"2018-10-04T00:00:00";"directive,donnees-ouvertes,inspire,natura-2000,sites-proteges,zps";False;6;2;"esri shapefile (shp)";"CSW-ISO-19139";"ogc.geo-ide.developpement-durable.gouv.fr";"2010-03-16T00:00:00";"2018-10-04T00:00:00";"http://catalogue.geo-ide.developpement-durable.gouv.fr/catalogue/srv/fre/catalog.search#/metadata/fr-120066022-jdd-c6f7f4d9-d39e-4e9b-9510-6bffe0a0cc29";"0.56";0;0;0;"{'2025-01': 0, '2025-02': 0, '2025-03': 0, '2025-04': 0, '2025-05': 0, '2025-06': 0, '2025-07': 0, '2025-08': 0, '2025-09': 0, '2025-10': 0, '2025-11': 0, '2025-12': 0, '2026-01': 0}";0;0;"{'2025-01': 0, '2025-02': 0, '2025-03': 0, '2025-04': 0, '2025-05': 0, '2025-06': 0, '2025-07': 0, '2025-08': 0, '2025-09': 0, '2025-10': 0, '2025-11': 0, '2025-12': 0, '2026-01': 0}";592;305
"660bf6bef4df8cd74900c519";"Carte de bruit stratégique - RN122 - nuit – voies de l’État dans le Cantal (Type A)";"carte-de-bruit-strategique-rn122-nuit-voies-de-letat-dans-le-cantal-type-a-1";"";"https://www.data.gouv.fr/datasets/carte-de-bruit-strategique-rn122-nuit-voies-de-letat-dans-le-cantal-type-a-1";"Direction Départementale et des Territoires du Cantal";"558ad939c751df7c4fa453bc";"";"";"Couche SIG reprenant le tracé des cartes de bruit stratégiques dites « de la 2ème échéance », prévues par la Directive européenne 2002/49/CE et par les articles L.572-1 et suivants du code de l'environnement.                                                                       Réseau concerné : réseau routier national dans le Cantal                Voies concernées : N122                                                           Type de carte : A                                                                                                                                                                Source : arrêté du Préfet du Cantal n°2014-0942 du 22 juillet 2014 + rapport technique CEREMA (avril 2014)";"";"";"Licence Ouverte / Open Licence version 2.0";"";"";"other";"";False;"2016-09-20T00:00:00";"2016-09-20T00:00:00";"donnees-ouvertes,inspire,nuisance-bruit,route,zones-de-gestion-de-restriction-ou-de-reglementation-et-unites-de-declaration";False;6;2;"esri shapefile (shp)";"CSW-ISO-19139";"ogc.geo-ide.developpement-durable.gouv.fr";"2012-04-01T00:00:00";"2016-09-20T00:00:00";"http://catalogue.geo-ide.developpement-durable.gouv.fr/catalogue/srv/fre/catalog.search#/metadata/fr-120066022-jdd-81d6a146-3b14-4dbe-8aca-43658d63ff43";"0.56";0;0;0;"{'2025-01': 0, '2025-02': 0, '2025-03': 0, '2025-04': 0, '2025-05': 0, '2025-06': 0, '2025-07': 0, '2025-08': 0, '2025-09': 0, '2025-10': 0, '2025-11': 0, '2025-12': 0, '2026-01': 0}";0;0;"{'2025-01': 0, '2025-02': 0, '2025-03': 0, '2025-04': 0, '2025-05': 0, '2025-06': 0, '2025-07': 0, '2025-08': 0, '2025-09': 0, '2025-10': 0, '2025-11': 0, '2025-12': 0, '2026-01': 0}";547;186
"660bf6be859355766100c519";"Nom des communes (A4)";"nom-des-communes-a4-1";"";"https://www.data.gouv.fr/datasets/nom-des-communes-a4-1";"Direction Départementale et des Territoires du Cantal";"558ad939c751df7c4fa453bc";"";"";"Couches des noms des communes réalisée à partir des étiquettes de la couche N_COMMUNES_015 de la BD Topo de l’IGN.";"";"";"Licence Ouverte / Open Licence version 2.0";"";"";"other";"";False;"2016-07-07T00:00:00";"2016-05-03T00:00:00";"commune,donnee-generique-habillage,donnees-ouvertes,nom";False;6;2;"esri shapefile (shp)";"CSW-ISO-19139";"ogc.geo-ide.developpement-durable.gouv.fr";"2010-04-07T00:00:00";"2016-05-03T00:00:00";"http://catalogue.geo-ide.developpement-durable.gouv.fr/catalogue/srv/fre/catalog.search#/metadata/fr-120066022-jdd-cfeff1e9-84bc-4825-8b91-74bd8af54697";"0.44";0;0;0;"{'2025-01': 0, '2025-02': 0, '2025-03': 0, '2025-04': 0, '2025-05': 0, '2025-06': 0, '2025-07': 0, '2025-08': 0, '2025-09': 0, '2025-10': 0, '2025-11': 0, '2025-12': 0, '2026-01': 0}";0;0;"{'2025-01': 0, '2025-02': 0, '2025-03': 0, '2025-04': 0, '2025-05': 0, '2025-06': 0, '2025-07': 0, '2025-08': 0, '2025-09': 0, '2025-10': 0, '2025-11': 0, '2025-12': 0, '2026-01': 0}";522;287
"660bf6bea9c3b12c3a83d69f";"Potentiel radon des communes du Cantal (15)";"potentiel-radon-des-communes-du-cantal-15";"";"https://www.data.gouv.fr/datasets/potentiel-radon-des-communes-du-cantal-15";"Direction Départementale et des Territoires du Cantal";"558ad939c751df7c4fa453bc";"";"";"Couche SIG portant délimitation des zones à potentiel radon à l’échelle communale aux termes de l’arrêté inter-ministériel du 27 juin 2018 portant délimitation des zones à potentiel radon du territoire français. Source : JORF du 30 juin 2018 ;  entrée en vigueur au 1er juillet 2018.";"";"";"Licence Ouverte / Open Licence version 2.0";"";"";"other";"";False;"2018-09-07T00:00:00";"2022-02-07T00:00:00";"donnees-ouvertes,inspire,radon,risques,zones-a-risque-naturel";False;6;2;"esri shapefile (shp)";"CSW-ISO-19139";"ogc.geo-ide.developpement-durable.gouv.fr";"2018-08-20T00:00:00";"2022-02-07T00:00:00";"http://catalogue.geo-ide.developpement-durable.gouv.fr/catalogue/srv/fre/catalog.search#/metadata/fr-120066022-jdd-0af4b8a2-d13d-4772-85cf-d254055d0acc";"0.56";0;0;0;"{'2025-01': 0, '2025-02': 0, '2025-03': 0, '2025-04': 0, '2025-05': 0, '2025-06': 0, '2025-07': 0, '2025-08': 0, '2025-09': 0, '2025-10': 0, '2025-11': 0, '2025-12': 0, '2026-01': 0}";0;0;"{'2025-01': 0, '2025-02': 0, '2025-03': 0, '2025-04': 0, '2025-05': 0, '2025-06': 0, '2025-07': 0, '2025-08': 0, '2025-09': 0, '2025-10': 0, '2025-11': 0, '2025-12': 0, '2026-01': 0}";1162;383
"660bf6bd955b07e38183d69f";"Espaces bâtis 2010 (Cantal)";"espaces-batis-2010-cantal-1";"";"https://www.data.gouv.fr/datasets/espaces-batis-2010-cantal-1";"Direction Départementale et des Territoires du Cantal";"558ad939c751df7c4fa453bc";"";"";"Couche locale, créée par la DDT du Cantal, pour servir de base au suivi et à l’analyse de la consommation des espaces agricoles, naturels et forestiers dans le département du Cantal. Couche décrivant les espaces urbanisés sur le territoire par photo-interprétation. Référentiel de saisie : BD ORTHO de l’IGN de 2010 + cadastre. Méthodologie d’élaboration détaillée : disponible sur demande auprès de la DDT du Cantal. Méthodologie d’élaboration sommaire : digitalisation des parcelles bâties après photo-interprétation systématique ; routes, rues et chemins non pris en compte ; prise en compte des parcelles cadastrales entières en zones urbaines ainsi que des cimetières, terrains de sport, zones d’activité etc. Sont considérées comme parcelles nouvelles celles sur lesquelles apparaît un bâtiment sur l’ortho-photoplan de 2010 non existant sur l’ortho-photoplan de 2005.";"";"";"Licence Ouverte / Open Licence version 2.0";"";"";"other";"";False;"2016-02-11T00:00:00";"2019-02-26T00:00:00";"amenagement-urbanisme-zonages-planification,donnees-ouvertes,inspire,usage-des-sols";False;6;2;"esri shapefile (shp)";"CSW-ISO-19139";"ogc.geo-ide.developpement-durable.gouv.fr";"2014-01-01T00:00:00";"2019-02-26T00:00:00";"http://catalogue.geo-ide.developpement-durable.gouv.fr/catalogue/srv/fre/catalog.search#/metadata/fr-120066022-jdd-52a39367-1aed-4eca-8c48-cce9f7665494";"0.56";0;0;0;"{'2025-01': 0, '2025-02': 0, '2025-03': 0, '2025-04': 0, '2025-05': 0, '2025-06': 0, '2025-07': 0, '2025-08': 0, '2025-09': 0, '2025-10': 0, '2025-11': 0, '2025-12': 0, '2026-01': 0}";0;0;"{'2025-01': 0, '2025-02': 0, '2025-03': 0, '2025-04': 0, '2025-05': 0, '2025-06': 0, '2025-07': 0, '2025-08': 0, '2025-09': 0, '2025-10': 0, '2025-11': 0, '2025-12': 0, '2026-01': 0}";326;156
"660bf6bde58991affb00c515";"Pôles de Service intermediaires du Cantal";"poles-de-service-intermediaires-du-cantal";"";"https://www.data.gouv.fr/datasets/poles-de-service-intermediaires-du-cantal";"Direction Départementale et des Territoires du Cantal";"558ad939c751df7c4fa453bc";"";"";"La base permanente des équipements (BPE) est destinée à fournir le niveau d'équipement et de services rendus par un territoire à la population. Une répartition des équipements en trois gammes :
- Gamme de proximité : École maternelle, pharmacie, boulangerie, la poste…
- Gamme intermédiaire : Collège, orthophoniste, supermarché, Trésor public…
- Gamme supérieure : Lycée, maternité, hypermarché, Pôle emploi…";"";"";"Licence Ouverte / Open Licence version 2.0";"";"";"other";"";False;"2016-05-09T00:00:00";"2016-05-03T00:00:00";"amenagement-urbanisme-zonages-etude,donnees-ouvertes,intermediaire,pole,service";False;6;2;"esri shapefile (shp)";"CSW-ISO-19139";"ogc.geo-ide.developpement-durable.gouv.fr";"2007-01-01T00:00:00";"2016-05-03T00:00:00";"http://catalogue.geo-ide.developpement-durable.gouv.fr/catalogue/srv/fre/catalog.search#/metadata/fr-120066022-jdd-d05844df-756a-4414-8d2e-4bc4c089aaef";"0.56";0;0;0;"{'2025-01': 0, '2025-02': 0, '2025-03': 0, '2025-04': 0, '2025-05': 0, '2025-06': 0, '2025-07': 0, '2025-08': 0, '2025-09': 0, '2025-10': 0, '2025-11': 0, '2025-12': 0, '2026-01': 0}";0;0;"{'2025-01': 0, '2025-02': 0, '2025-03': 0, '2025-04': 0, '2025-05': 0, '2025-06': 0, '2025-07': 0, '2025-08': 0, '2025-09': 0, '2025-10': 0, '2025-11': 0, '2025-12': 0, '2026-01': 0}";696;247
"660bf6bda9c3b12c3a83d69e";"Espaces bâtis 2000 du Cantal";"espaces-batis-2000-du-cantal-1";"";"https://www.data.gouv.fr/datasets/espaces-batis-2000-du-cantal-1";"Direction Départementale et des Territoires du Cantal";"558ad939c751df7c4fa453bc";"";"";"Couche locale, créée par la DDT du Cantal, pour servir de base au suivi et à l’analyse de la consommation des espaces agricoles, naturels et forestiers dans le département du Cantal. Couche décrivant les espaces urbanisés sur le territoire par photo-interprétation. Référentiel de saisie : BD ORTHO de l’IGN de 2000 + cadastre. Méthodologie d’élaboration détaillée : disponible sur demande auprès de la DDT du Cantal. Méthodologie d’élaboration sommaire : digitalisation des parcelles bâties après photo-interprétation systématique ; routes, rues et chemins non pris en compte ; prise en compte des parcelles cadastrales entières en zones urbaines ainsi que des cimetières, terrains de sport, zones d’activité etc.";"";"";"Licence Ouverte / Open Licence version 2.0";"";"";"other";"";False;"2016-02-11T00:00:00";"2019-02-26T00:00:00";"amenagement-urbanisme-zonages-planification,donnees-ouvertes,inspire,usage-des-sols";False;6;2;"esri shapefile (shp)";"CSW-ISO-19139";"ogc.geo-ide.developpement-durable.gouv.fr";"2010-11-01T00:00:00";"2019-02-26T00:00:00";"http://catalogue.geo-ide.developpement-durable.gouv.fr/catalogue/srv/fre/catalog.search#/metadata/fr-120066022-jdd-ed576624-85e9-44b4-a914-f47681c83971";"0.56";0;0;0;"{'2025-01': 0, '2025-02': 0, '2025-03': 0, '2025-04': 0, '2025-05': 0, '2025-06': 0, '2025-07': 0, '2025-08': 0, '2025-09': 0, '2025-10': 0, '2025-11': 0, '2025-12': 0, '2026-01': 0}";0;0;"{'2025-01': 0, '2025-02': 0, '2025-03': 0, '2025-04': 0, '2025-05': 0, '2025-06': 0, '2025-07': 0, '2025-08': 0, '2025-09': 0, '2025-10': 0, '2025-11': 0, '2025-12': 0, '2026-01': 0}";414;160
"660bf6bdf6c536876500c518";"N_PR_P_015";"n-pr-p-015";"";"https://www.data.gouv.fr/datasets/n-pr-p-015";"Direction Départementale et des Territoires du Cantal";"558ad939c751df7c4fa453bc";"";"";"N_PR_P_015";"";"";"Licence Ouverte / Open Licence version 2.0";"";"";"other";"";False;"2018-03-30T00:00:00";"2018-03-29T00:00:00";"donnees-ouvertes,inspire,reseaux-de-transport";False;6;2;"esri shapefile (shp)";"CSW-ISO-19139";"ogc.geo-ide.developpement-durable.gouv.fr";"2017-01-04T00:00:00";"2018-03-29T00:00:00";"http://catalogue.geo-ide.developpement-durable.gouv.fr/catalogue/srv/fre/catalog.search#/metadata/fr-120066022-jdd-3b73e9a0-123a-46c5-aaab-45c7e9ef6f7c";"0.44";0;0;0;"{'2025-01': 0, '2025-02': 0, '2025-03': 0, '2025-04': 0, '2025-05': 0, '2025-06': 0, '2025-07': 0, '2025-08': 0, '2025-09': 0, '2025-10': 0, '2025-11': 0, '2025-12': 0, '2026-01': 0}";0;0;"{'2025-01': 0, '2025-02': 0, '2025-03': 0, '2025-04': 0, '2025-05': 0, '2025-06': 0, '2025-07': 0, '2025-08': 0, '2025-09': 0, '2025-10': 0, '2025-11': 0, '2025-12': 0, '2026-01': 0}";466;155
"660bf6bd2d9919befc00c519";"Elément linéaire engagé dans une MAET dans le Cantal";"element-lineaire-engage-dans-une-maet-dans-le-cantal";"";"https://www.data.gouv.fr/datasets/element-lineaire-engage-dans-une-maet-dans-le-cantal";"Direction Départementale et des Territoires du Cantal";"558ad939c751df7c4fa453bc";"";"";"Elément linéaire engagé dans une mesure agro-environnementale territorialisée (MAET) pour la campagne 2008
L'élément engagé (engagement contractualisé par un bénéficiaire) est un élément de l'espace agricole sur lequel portent les obligations agroenvironnementales définies dans le cahier des charges de la mesure agroenvironnementale sur laquelle il est engagé.
Un élément linéaire engagé dans une mesure agroenvironnementale peut être un alignement d'arbres, une haie, un fossé, etc.. .
La couche est définie par campagne du 15 mai au 14 mai.
Restent références réglementaires à ajouter
1) Remarque complémentaire sur la mise à jour : Actualisation au fil de la campagne pour une stabilisation en fin de campagne (des modifications restent possibles sur la couche de l'année N-1 en année N)
2) Couche liée à la couche #1003 N_PERIM_MAET_ZINF_S qui définit les périmètres éligibles aux MAET
3) Couches jumelles : #1075 élément surfacique ; #1129 élément ponctuel";"";"";"License Not Specified";"";"";"other";"";False;"2014-07-01T00:00:00";"2013-09-03T00:00:00";"agriculture-agri-environnement";False;0;0;"";"CSW-ISO-19139";"ogc.geo-ide.developpement-durable.gouv.fr";"2013-09-05T00:00:00";"2013-09-03T00:00:00";"http://catalogue.geo-ide.developpement-durable.gouv.fr/catalogue/srv/fre/catalog.search#/metadata/fr-120066022-jdd-89dc7eec-b6cf-47d7-948e-3d3d26fb73e1";"0.33";0;0;0;"{'2025-01': 0, '2025-02': 0, '2025-03': 0, '2025-04': 0, '2025-05': 0, '2025-06': 0, '2025-07': 0, '2025-08': 0, '2025-09': 0, '2025-10': 0, '2025-11': 0, '2025-12': 0, '2026-01': 0}";0;0;"{'2025-01': 0, '2025-02': 0, '2025-03': 0, '2025-04': 0, '2025-05': 0, '2025-06': 0, '2025-07': 0, '2025-08': 0, '2025-09': 0, '2025-10': 0, '2025-11': 0, '2025-12': 0, '2026-01': 0}";598;""
"660bf6bd955b07e38183d69e";"Unités de méthanisation autorisées (Cantal)";"unites-de-methanisation-autorisees-cantal";"";"https://www.data.gouv.fr/datasets/unites-de-methanisation-autorisees-cantal";"Direction Départementale et des Territoires du Cantal";"558ad939c751df7c4fa453bc";"";"";"Couche SIG décrivant les unités de méthanisation autorisées dans le département du Cantal, à partir des renseignements fournis par les services-métiers. Les unités sont identifées par un symbole ponctuel positionné sur la parcelle d'implantation de l'unité de méthanisation Source : DDT 15, 2018.";"";"";"Licence Ouverte / Open Licence version 2.0";"";"";"other";"";False;"2018-04-27T00:00:00";"2020-01-28T00:00:00";"donnees-ouvertes,energies,methanisation,site-industriel-production-site-de-production-denergie";False;6;2;"esri shapefile (shp)";"CSW-ISO-19139";"ogc.geo-ide.developpement-durable.gouv.fr";"2018-04-12T00:00:00";"2020-01-28T00:00:00";"http://catalogue.geo-ide.developpement-durable.gouv.fr/catalogue/srv/fre/catalog.search#/metadata/fr-120066022-jdd-db25dca2-dacd-4bfa-af1d-5f5f5b9f4e0c";"0.56";0;0;0;"{'2025-01': 0, '2025-02': 0, '2025-03': 0, '2025-04': 0, '2025-05': 0, '2025-06': 0, '2025-07': 0, '2025-08': 0, '2025-09': 0, '2025-10': 0, '2025-11': 0, '2025-12': 0, '2026-01': 0}";0;0;"{'2025-01': 0, '2025-02': 0, '2025-03': 0, '2025-04': 0, '2025-05': 0, '2025-06': 0, '2025-07': 0, '2025-08': 0, '2025-09': 0, '2025-10': 0, '2025-11': 0, '2025-12': 0, '2026-01': 0}";814;354
"660bf6bdf80427f53a00c518";"Centres de secours secondaires extérieur (Cantal)";"centres-de-secours-secondaires-exterieur-cantal";"";"https://www.data.gouv.fr/datasets/centres-de-secours-secondaires-exterieur-cantal";"Direction Départementale et des Territoires du Cantal";"558ad939c751df7c4fa453bc";"";"";"Centres de secours secondaires aux limites extérieures du Cantal";"";"";"Licence Ouverte / Open Licence version 2.0";"";"";"other";"";False;"2016-02-11T00:00:00";"2016-02-09T00:00:00";"donnee-generique-action-publique,donnees-ouvertes";False;2;0;"esri shapefile (shp)";"CSW-ISO-19139";"ogc.geo-ide.developpement-durable.gouv.fr";"2012-06-14T00:00:00";"2016-02-09T00:00:00";"http://catalogue.geo-ide.developpement-durable.gouv.fr/catalogue/srv/fre/catalog.search#/metadata/fr-120066022-jdd-4e8b4fd2-f3f9-4a71-9371-3761955c3992";"0.44";0;0;0;"{'2025-01': 0, '2025-02': 0, '2025-03': 0, '2025-04': 0, '2025-05': 0, '2025-06': 0, '2025-07': 0, '2025-08': 0, '2025-09': 0, '2025-10': 0, '2025-11': 0, '2025-12': 0, '2026-01': 0}";0;0;"{'2025-01': 0, '2025-02': 0, '2025-03': 0, '2025-04': 0, '2025-05': 0, '2025-06': 0, '2025-07': 0, '2025-08': 0, '2025-09': 0, '2025-10': 0, '2025-11': 0, '2025-12': 0, '2026-01': 0}";317;55
"660bf6bc859355766100c518";"Plan d’exposition au bruit de l’aéroport d’Aurilllac";"plan-dexposition-au-bruit-de-laeroport-daurilllac";"";"https://www.data.gouv.fr/datasets/plan-dexposition-au-bruit-de-laeroport-daurilllac";"Direction Départementale et des Territoires du Cantal";"558ad939c751df7c4fa453bc";"";"";"PEB de l’aéroport d’Aurillac, approuvé par arrêté préfectoral n° 2006-381 du 21 mars 2006.";"";"";"Licence Ouverte / Open Licence version 2.0";"";"";"other";"";False;"2016-08-03T00:00:00";"2016-08-03T00:00:00";"donnees-ouvertes,inspire,nuisance-bruit,zones-de-gestion-de-restriction-ou-de-reglementation-et-unites-de-declaration";False;6;2;"esri shapefile (shp)";"CSW-ISO-19139";"ogc.geo-ide.developpement-durable.gouv.fr";"2006-03-21T00:00:00";"2016-08-03T00:00:00";"http://catalogue.geo-ide.developpement-durable.gouv.fr/catalogue/srv/fre/catalog.search#/metadata/fr-120066022-jdd-5c837de9-625a-4900-83f2-25542f250dee";"0.44";0;0;0;"{'2025-01': 0, '2025-02': 0, '2025-03': 0, '2025-04': 0, '2025-05': 0, '2025-06': 0, '2025-07': 0, '2025-08': 0, '2025-09': 0, '2025-10': 0, '2025-11': 0, '2025-12': 0, '2026-01': 0}";0;0;"{'2025-01': 0, '2025-02': 0, '2025-03': 0, '2025-04': 0, '2025-05': 0, '2025-06': 0, '2025-07': 0, '2025-08': 0, '2025-09': 0, '2025-10': 0, '2025-11': 0, '2025-12': 0, '2026-01': 0}";593;176
"660bf6bcbc82b7fcc900c518";"Micro-centrales hydroélectriques du Cantal";"micro-centrales-hydroelectriques-du-cantal-1";"";"https://www.data.gouv.fr/datasets/micro-centrales-hydroelectriques-du-cantal-1";"Direction Départementale et des Territoires du Cantal";"558ad939c751df7c4fa453bc";"";"";"Ouvrages sur les cours d’eau autorisés pour la production d’électricité (hors ouvrages concédés sur retenue)";"";"";"License Not Specified";"";"";"other";"";False;"2016-06-20T00:00:00";"2018-04-13T00:00:00";"donnees-ouvertes,reseau-energie-divers-electricite";"2024-05-13T09:10:02.612000";0;0;"";"CSW-ISO-19139";"ogc.geo-ide.developpement-durable.gouv.fr";"2016-06-20T00:00:00";"2018-04-13T00:00:00";"";"0.22";0;0;0;0;0;0;0;143;""
"660bf6bcb0fdea435300c518";"Stations d'épuration localisées ponctuellement dans le Cantal";"stations-depuration-localisees-ponctuellement-dans-le-cantal";"";"https://www.data.gouv.fr/datasets/stations-depuration-localisees-ponctuellement-dans-le-cantal";"Direction Départementale et des Territoires du Cantal";"558ad939c751df7c4fa453bc";"";"";"Stations d'épuration localisées ponctuellement
Stations d'épuration des eaux usées domestiques (par différence avec les stations d'épuration des eaux industrielles)
Couche en lien pour les données attributaires avec applications ""métier"" identifiées";"";"";"Licence Ouverte / Open Licence version 2.0";"";"";"other";"";False;"2016-07-27T00:00:00";"2016-07-26T00:00:00";"assainissement,donnees-ouvertes,eau-assainissement,epuration,inspire,services-dutilite-publique-et-services-publics,station";False;6;2;"esri shapefile (shp)";"CSW-ISO-19139";"ogc.geo-ide.developpement-durable.gouv.fr";"2013-07-29T00:00:00";"2016-07-26T00:00:00";"http://catalogue.geo-ide.developpement-durable.gouv.fr/catalogue/srv/fre/catalog.search#/metadata/fr-120066022-jdd-0e870510-3468-4e51-bab4-6a5d068376e7";"0.56";0;0;0;"{'2025-01': 0, '2025-02': 0, '2025-03': 0, '2025-04': 0, '2025-05': 0, '2025-06': 0, '2025-07': 0, '2025-08': 0, '2025-09': 0, '2025-10': 0, '2025-11': 0, '2025-12': 0, '2026-01': 0}";0;0;"{'2025-01': 0, '2025-02': 0, '2025-03': 0, '2025-04': 0, '2025-05': 0, '2025-06': 0, '2025-07': 0, '2025-08': 0, '2025-09': 0, '2025-10': 0, '2025-11': 0, '2025-12': 0, '2026-01': 0}";1020;389
"660bf6bca9c3b12c3a83d69d";"Zone homogène selon des critères agro-climatiques qui conditionnent la production herbagère en Auvergne";"zone-homogene-selon-des-criteres-agro-climatiques-qui-conditionnent-la-production-herbagere-en-auvergne-1";"";"https://www.data.gouv.fr/datasets/zone-homogene-selon-des-criteres-agro-climatiques-qui-conditionnent-la-production-herbagere-en-auvergne-1";"Direction Départementale et des Territoires du Cantal";"558ad939c751df7c4fa453bc";"";"";"Zone homogène selon des critères agro-climatiques qui conditionnent la production herbagère.
Ce zonage a été constitué à partir des résultats de l'enquête « prairies » faite par le SCEES en 1982. Il a été déterminé en fonction des critères suivants :
- climat (en particulier l'hygrométrie)
- altitude moyenne
- géologie (nature du sol et du sous-sol)
Elles ont été revues en 1998 afin de travailler sur des zones d'au moins 90 000 hectares. Elles servent de base au système ISOP (Informations et Suivi Objectif des Prairies) qui fournit des estimations de rendement des prairies temporaires et permanentes productives.
Les 228 régions fourragères françaises excluent les départements peu fourragers : l'île de France et le pourtour méditerranéen.";"";"";"Licence Ouverte / Open Licence version 2.0";"";"";"other";"";False;"2016-07-11T00:00:00";"2016-07-11T00:00:00";"agriculture-zonages-agricoles,donnees-ouvertes,inspire,unites-statistiques";False;6;2;"esri shapefile (shp)";"CSW-ISO-19139";"ogc.geo-ide.developpement-durable.gouv.fr";"2011-04-08T00:00:00";"2016-07-11T00:00:00";"http://catalogue.geo-ide.developpement-durable.gouv.fr/catalogue/srv/fre/catalog.search#/metadata/fr-120066022-jdd-3ba68df1-a179-4636-98ec-60fc2191ac83";"0.56";0;0;0;"{'2025-01': 0, '2025-02': 0, '2025-03': 0, '2025-04': 0, '2025-05': 0, '2025-06': 0, '2025-07': 0, '2025-08': 0, '2025-09': 0, '2025-10': 0, '2025-11': 0, '2025-12': 0, '2026-01': 0}";0;0;"{'2025-01': 0, '2025-02': 0, '2025-03': 0, '2025-04': 0, '2025-05': 0, '2025-06': 0, '2025-07': 0, '2025-08': 0, '2025-09': 0, '2025-10': 0, '2025-11': 0, '2025-12': 0, '2026-01': 0}";480;165
