"id";"title";"slug";"acronym";"url";"organization";"organization_id";"owner";"owner_id";"description";"description_short";"frequency";"license";"temporal_coverage.start";"temporal_coverage.end";"spatial.granularity";"spatial.zones";"featured";"created_at";"last_modified";"tags";"archived";"resources_count";"main_resources_count";"resources_formats";"harvest.backend";"harvest.domain";"harvest.created_at";"harvest.modified_at";"harvest.remote_url";"quality_score";"metric.discussions";"metric.discussions_open";"metric.reuses";"metric.reuses_by_months";"metric.dataservices";"metric.followers";"metric.followers_by_months";"metric.views";"metric.resources_downloads"
"597b4542c751df06dd254d57";"Tronçons élémentaires de masse d'eau cours d'eau - Martinique - Version Rapportage 2016";"troncons-elementaires-de-masse-deau-cours-deau-martinique-version-rapportage-2016";"";"https://www.data.gouv.fr/datasets/troncons-elementaires-de-masse-deau-cours-deau-martinique-version-rapportage-2016";"Système d'Information sur l'Eau";"534fffb2a3a7292c64a78123";"";"";"Le tronçon élémentaire de masse d’eau cours d’eau permet de répondre à deux objectifs. Tout d’abord de détailler la composition de la masse d’eau cours d’eau en tronçons élémentaires situés en surface ou souterrains (de la même manière que la BDCarthage). La géométrie du thème Masse d’eau de surface / Rivières est alors l’agrégation des tronçons élémentaires qui la compose.
Il permet également d’assurer la continuité du réseau de masses d’eau en créant des tronçons fictifs traversant les masses d’eau plan d’eau, côtière ou de transition mais également en permettant d’assurer la connexion des masses d’eau par l’intermédiaire d’affluents présent dans le réseau hydrographique de la BDCarthage mais non identifiés comme faisant parti d’une masse d’eau au regard des règles de constitution du référentiel des masses d’eau.
Dans le cas où ce tronçon correspond à un tronçon élémentaire présent dans la BDCarthage, cet élément héritera donc des caractéristiques du tronçon hydrographique élémentaire en question.
Correspondance rapportage DCE : cette entité correspond au concept de River Water Body Segment de WISE.";"";"";"Licence Ouverte / Open Licence";"2016-11-30";"2022-11-30";"other";"";False;"2021-06-09T12:48:30";"2020-09-17T06:38:20.319000";"cours-deau,dce,directive-2000-60-ec,directive-cadre-eau,donnees-de-references-referentiels-vocabulaire-controle,donnees-ouvertes,eau-continentale,eau-de-surface,eaux-interieures-de-surface-rivieres-et-lacs,france,hvd,martinique,masse-deau,masse-deau-de-surface,mtq,observation-de-la-terre-et-environnement,politique-de-lenvironnement,regional,riviere,vrap,zones-de-gestion-de-restriction-ou-de-reglementation-et-unites-de-declaration";False;5;5;"file:geo,ogc:wfs,www:link-1.0-http--link,ogc:wms";"CSW-DCAT";"data.ofb.fr";"";"";"";"0.67";0;0;0;"{'2024-08': 0, '2024-09': 0, '2024-10': 0, '2024-11': 0, '2024-12': 0, '2025-01': 0, '2025-02': 0, '2025-03': 0, '2025-04': 0, '2025-05': 0, '2025-06': 0, '2025-07': 0, '2025-08': 0}";0;0;"{'2024-08': 0, '2024-09': 0, '2024-10': 0, '2024-11': 0, '2024-12': 0, '2025-01': 0, '2025-02': 0, '2025-03': 0, '2025-04': 0, '2025-05': 0, '2025-06': 0, '2025-07': 0, '2025-08': 0}";1091;1369
"597b454288ee383d4357929b";"Tronçons hydrographiques - Guadeloupe 2009 - BD Carthage";"troncons-hydrographiques-guadeloupe-2009-bd-carthage";"";"https://www.data.gouv.fr/datasets/troncons-hydrographiques-guadeloupe-2009-bd-carthage";"Système d'Information sur l'Eau";"534fffb2a3a7292c64a78123";"";"";"Un tronçon hydrographique élémentaire est une portion connexe de rivières, de ruisseau ou de canal, homogène pour les relations la mettant en jeu, et pour les attributs qu’elle port. Il correspond à l&#x27;axe du lit d&#x27;une rivière, d&#x27;un ruisseau ou d&#x27;un canal.
Il s’agit :
- sur le territoire national :
		- tous les axes principaux, y compris dans la zone d&#x27;estran jusqu’à la cote zéro NGF et dans les zones de marais. Les &quot;culs de sac&quot;, quelle que soit leur longueur (au minimum de 20 mètres), l&#x27;exhaustivité est assurée pour les culs-de-sac d&#x27;une longueur supérieure à un kilomètre ou appartenant à un cours d&#x27;eau d&#x27;une longueur supérieure à un kilomètre.
		- outre l&#x27;axe principal, les axes des bras secondaires ou qui délimitent une île d&#x27;une superficie supérieure à 10 hectares quand un cours d&#x27;eau se subdivise en plusieurs.
- à l&#x27;étranger : 
		- tous les tronçons hydrographiques qui assurent la continuité, vers l&#x27;amont ou vers l&#x27;aval, du réseau du territoire national ;
		- tous les tronçons de canaux navigables ;
		- les tronçons de cours d&#x27;eau importants.
La continuité du réseau est assurée lors de la traversée de plans d&#x27;eau, de zones de marais, de drainage, d&#x27;agglomérations.
Un tronçon hydrographique élémentaire est représenté par un arc. Par contre, un arc peut correspondre à plusieurs tronçons élémentaires lorsqu’il y a une superposition des cours d’eau. Les éléments du réseau d&#x27;hydrographie sont découpés en portions ayant les mêmes attributs. Le changement de valeur d&#x27;un attribut n&#x27;entraîne la création d&#x27;un tronçon que si la nouvelle valeur reste la même sur une longueur d&#x27;au moins 20 mètres ; sinon, le tronçon précédent est prolongé.
Le tronçon hydrographique élémentaire est caractérisé par un ensemble d&#x27;attributs géré par l&#x27;IGN : Etat, sens d&#x27;écoulement, largeur, nature, navigabilité, gabarit, position par rapport au sol.
Un tronçon hydrographique élémentaire n’est pas à confondre avec le tronçon hydrographique, notion introduite par la circulaire n°91-50. 
La BDCarthage Guadeloupe est maintenue par la DEAL Guadeloupe. La structure de la base de données est identique au format métropole.La BD Carthage Guadeloupe est une version validée par le SIE mais pas par l&#x27;IGN et que donc des problemes d&#x27;incompatibilité avec des referentiels IGN peuvent survenir (et qu&#x27;une mise à jour &quot;officialisera&quot; la BD Carthage avec la validation IGN).
__Origine__
La BDCarthage Guadeloupe est maintenue par la DEAL Guadeloupe.
__Organisations partenaires__
SANDRE
__Liens annexes__
 * [Consulter la documentation sur le site Sandre](http://www.sandre.eaufrance.fr/?urn&#x3D;urn:sandre:dictionnaire:ETH::entite:TronconHydrograElt:ressource:latest:::html)
 * [Consulter le dictionnaire &quot;Référentiel hydrographique (ETH)&quot; sur le site Sandre](http://www.sandre.eaufrance.fr/?urn&#x3D;urn:sandre:notice:dictionnaire::theme:ETH:ressource:latest:::html)
➞ [Consulter cette fiche sur geo.data.gouv.fr](https://geo.data.gouv.fr/fr/datasets/63349ac17e20e778dac894d5609ec7d2ba4ebece)";"";"unknown";"Licence Ouverte / Open Licence version 2.0";"";"";"other";"";False;"2017-07-28T16:08:02.481000";"2020-01-24T12:57:08.623000";"bd-carthage,donnees-ouvertes,eau-de-surface,france,guadeloupe,hydrographie,inland-waters,passerelle-inspire,politique-de-lenvironnement";"2024-03-21T12:26:08.573000";2;0;"zip,document";"";"";"";"";"";"0.67";0;0;0;0;0;0;0;686;124
"597b4542c751df0709bff26d";"Tronçons élémentaires de masse d'eau cours d'eau - Guadeloupe- Version Rapportage 2016";"troncons-elementaires-de-masse-deau-cours-deau-guadeloupe-version-rapportage-2016";"";"https://www.data.gouv.fr/datasets/troncons-elementaires-de-masse-deau-cours-deau-guadeloupe-version-rapportage-2016";"Système d'Information sur l'Eau";"534fffb2a3a7292c64a78123";"";"";"Le tronçon élémentaire de masse d’eau cours d’eau permet de répondre à deux objectifs. Tout d’abord de détailler la composition de la masse d’eau cours d’eau en tronçons élémentaires situés en surface ou souterrains (de la même manière que la BDCarthage). La géométrie du thème Masse d’eau de surface / Rivières est alors l’agrégation des tronçons élémentaires qui la compose.
Il permet également d’assurer la continuité du réseau de masses d’eau en créant des tronçons fictifs traversant les masses d’eau plan d’eau, côtière ou de transition mais également en permettant d’assurer la connexion des masses d’eau par l’intermédiaire d’affluents présent dans le réseau hydrographique de la BDCarthage mais non identifiés comme faisant parti d’une masse d’eau au regard des règles de constitution du référentiel des masses d’eau.
Dans le cas où ce tronçon correspond à un tronçon élémentaire présent dans la BDCarthage, cet élément héritera donc des caractéristiques du tronçon hydrographique élémentaire en question.
Correspondance rapportage DCE : cette entité correspond au concept de River Water Body Segment de WISE.";"";"";"Licence Ouverte / Open Licence";"2016-11-30";"2022-11-30";"other";"";False;"2021-06-09T12:48:30";"2020-09-17T06:38:20.331000";"cours-deau,dce,directive-2000-60-ec,directive-cadre-eau,donnees-de-references-referentiels-vocabulaire-controle,donnees-ouvertes,eau-continentale,eau-de-surface,eaux-interieures-de-surface-rivieres-et-lacs,france,glp,guadeloupe,hvd,masse-deau,masse-deau-de-surface,observation-de-la-terre-et-environnement,politique-de-lenvironnement,regional,riviere,vrap,zones-de-gestion-de-restriction-ou-de-reglementation-et-unites-de-declaration";False;5;5;"file:geo,ogc:wfs,www:link-1.0-http--link,ogc:wms";"CSW-DCAT";"data.ofb.fr";"";"";"";"0.67";0;0;0;"{'2024-08': 0, '2024-09': 0, '2024-10': 0, '2024-11': 0, '2024-12': 0, '2025-01': 0, '2025-02': 0, '2025-03': 0, '2025-04': 0, '2025-05': 0, '2025-06': 0, '2025-07': 0, '2025-08': 0}";0;0;"{'2024-08': 0, '2024-09': 0, '2024-10': 0, '2024-11': 0, '2024-12': 0, '2025-01': 0, '2025-02': 0, '2025-03': 0, '2025-04': 0, '2025-05': 0, '2025-06': 0, '2025-07': 0, '2025-08': 0}";1546;1307
"597b4540c751df06dd254d56";"Nœuds hydrographiques - Mayotte 2013 - BD Carthage";"noeuds-hydrographiques-mayotte-2013-bd-carthage";"";"https://www.data.gouv.fr/datasets/noeuds-hydrographiques-mayotte-2013-bd-carthage";"Système d'Information sur l'Eau";"534fffb2a3a7292c64a78123";"";"";"Un nœud hydrographique correspond à une modification de l'écoulement de l'eau. Il est toujours localisé à l’extrémité d’un tronçon hydrographique élémentaire. 
La classe des nœuds hydrographiques gérée par l'IGN comprend :
	- les confluences, diffluences, sources, embouchures et pertes de cours d'eau ;
	- les barrages de retenue ;
	- les barrages au fil de l'eau ;
	- les écluses (pour le passage ou le radoub) ;
	- les sources et les cascades d'intérêt touristique.
Un nœud hydrographique est localisé par un sommet géométrique. Certains noeuds correspondent à un exutoire d'une zone hydrographique.";"";"irregular";"Licence Ouverte / Open Licence version 2.0";"";"";"other";"";False;"2017-07-28T16:08:00.377000";"2020-12-31T06:38:19.485000";"bd-carthage,donnees-de-references-referentiels-vocabulaire-controle,donnees-ouvertes,eau-de-surface,eaux-interieures-de-surface-rivieres-et-lacs,france,hvd,hydrographie,mayotte,observation-de-la-terre-et-environnement,politique-de-lenvironnement";False;4;4;"www:link-1.0-http--link";"CSW-DCAT";"data.ofb.fr";"";"";"";"0.67";0;0;0;"{'2024-08': 0, '2024-09': 0, '2024-10': 0, '2024-11': 0, '2024-12': 0, '2025-01': 0, '2025-02': 0, '2025-03': 0, '2025-04': 0, '2025-05': 0, '2025-06': 0, '2025-07': 0, '2025-08': 0}";0;0;"{'2024-08': 0, '2024-09': 0, '2024-10': 0, '2024-11': 0, '2024-12': 0, '2025-01': 0, '2025-02': 0, '2025-03': 0, '2025-04': 0, '2025-05': 0, '2025-06': 0, '2025-07': 0, '2025-08': 0}";966;465
"597b4540c751df07218bf1ae";"Tronçons élémentaires de masse d'eau cours d'eau - Guadeloupe - Version Rapportage 2010";"troncons-elementaires-de-masse-deau-cours-deau-guadeloupe-version-rapportage-2010";"";"https://www.data.gouv.fr/datasets/troncons-elementaires-de-masse-deau-cours-deau-guadeloupe-version-rapportage-2010";"Système d'Information sur l'Eau";"534fffb2a3a7292c64a78123";"";"";"Le tronçon élémentaire de masse d’eau cours d’eau permet de répondre à deux objectifs. Tout d’abord de détailler la composition de la masse d’eau cours d’eau en tronçons élémentaires  situés en surface ou souterrains (de  la même  manière  que  la  BDCarthage). La  géométrie  du  thème  Masse  d’eau  de  surface  /  Rivières  est  alors l’agrégation des  tronçons élémentaires qui  la compose.
Il permet également d’assurer la continuité du réseau de masses d’eau en créant des tronçons fictifs traversant les masses d’eau plan d’eau, côtière ou de transition mais également en permettant d’assurer la connexion des masses d’eau par l’intermédiaire d’affluents présent dans le réseau hydrographique de la BDCarthage mais non identifiés comme faisant parti d’une masse d’eau au regard des règles de constitution du référentiel des masses d’eau.
Dans le cas où ce tronçon correspond à un tronçon élémentaire présent dans la BDCarthage, cet élément héritera donc des caractéristiques du tronçon hydrographique élémentaire en question.
Correspondance rapportage DCE : cette entité correspond au concept de River Water Body Segment de WISE.";"";"";"Licence Ouverte / Open Licence";"2010-11-30";"2016-11-30";"other";"";False;"2017-07-28T16:08:00.240000";"2020-01-24T12:57:09.997000";"cours-deau,dce,directive-2000-60-ec,directive-cadre-eau,donnees-de-references-referentiels-vocabulaire-controle,donnees-ouvertes,eau-continentale,eau-de-surface,eaux-interieures-de-surface-rivieres-et-lacs,france,glp,guadeloupe,hvd,masse-deau,masse-deau-de-surface,observation-de-la-terre-et-environnement,politique-de-lenvironnement,regional,riviere,vrap,zones-de-gestion-de-restriction-ou-de-reglementation-et-unites-de-declaration";False;5;5;"";"CSW-DCAT";"data.ofb.fr";"";"";"";"0.44";0;0;0;"{'2024-08': 0, '2024-09': 0, '2024-10': 0, '2024-11': 0, '2024-12': 0, '2025-01': 0, '2025-02': 0, '2025-03': 0, '2025-04': 0, '2025-05': 0, '2025-06': 0, '2025-07': 0, '2025-08': 0}";0;0;"{'2024-08': 0, '2024-09': 0, '2024-10': 0, '2024-11': 0, '2024-12': 0, '2025-01': 0, '2025-02': 0, '2025-03': 0, '2025-04': 0, '2025-05': 0, '2025-06': 0, '2025-07': 0, '2025-08': 0}";1076;1463
"597b453d88ee383d3c10c6b7";"Polygones élémentaires de masses d'eau souterraines - Martinique - Version Rapportage 2010";"polygones-elementaires-de-masses-deau-souterraines-martinique-version-rapportage-2010";"";"https://www.data.gouv.fr/datasets/polygones-elementaires-de-masses-deau-souterraines-martinique-version-rapportage-2010";"Système d'Information sur l'Eau";"534fffb2a3a7292c64a78123";"";"";"Une masse d'eau souterraine est un volume distinct d'eau souterraine à l'intérieur d'un ou de plusieurs aquifères, constituant le découpage élémentaire des milieux aquatiques destinée à être l'unité d'évaluation de la DCE. Elle permet de définir les objectifs environnementaux, d’évaluer l’état des milieux et ultérieurement de vérifier l’atteinte de ces objectifs.
Les masses d'eau souterraine, s’appuyant sur les travaux réalisés sur le référentiel hydrogéologique BDRHF V1 ont été identifiées et délimitées pour la première fois en 2004 puis ont été mises à jour en 2010. Elles ont fait l’objet du rapportage à la Commission Européenne sur la mise en œuvre de la DCE le 22 mars 2010, puis d’un rapportage correctif en février 2011, prenant ainsi en compte les dernières mises à jour.
Début 2013, un travail de mise en cohérence et de mise au format Sandre de la version rapportée à l’Europe de février 2011 a été réalisé.
La version désormais diffusée sur le site du SANDRE est conforme au rapportage de 2010 corrigé février 2011 ; elle contient cependant un certain nombre d’anomalies, présentes dans les données rapportées, et mises en exergue dans le rapport BRGM/RP-62141-FR. Ces anomalies feront l’objet de corrections dans la prochaine version du référentiel Masse d’eau (masses d’eau provisoires, définies pour l’Etat des Lieux 2013, puis masses d’eau pour le plan de gestion 2016-2021).    
Les couches sont diffusées dans un format conforme au dictionnaire de données SANDRE du Référentiel masse d’eau, version 1.2. 
Le découpage retenu pour les masses d’eau répond aux quelques grands principes exposés ci-après :
Les masses d’eau sont délimitées sur la base de critères géologiques et hydrogéologiques,
Le redécoupage des masses d’eau pour tenir compte des effets des pressions anthropiques doit rester limité.
Les limites des masses d’eau doivent être stables et durables
A l’image des masses d’eau superficielle, la délimitation des masses d’eau souterraine est organisée à partir d’une typologie. Cette typologie s’inspire largement de celle élaborée pour les entités hydrogéologiques définies dans le cadre de la révision de la BD RHF. Elle est basée sur la nature géologique et le comportement hydrodynamique ou fonctionnement « en grand » des systèmes aquifères (nature, vitesse des écoulements). Elle comprend deux niveaux de caractéristiques, principales et secondaires.
Les masses d’eau peuvent avoir des échanges entre elles.
Tous les captages d’Alimentation en Eau Potable, fournissant plus de 10 m3/jour d’eau potable ou utilisés pour l’alimentation en eau de plus de 50 personnes, doivent être inclus dans une masse d’eau.
Les eaux souterraines profondes, sans lien avec les cours d’eau et les écosystèmes de surface, dans lesquelles il ne s’effectue aucun prélèvement et qui ne sont pas susceptibles d’être utilisées pour l’eau potable en raison de leur qualité (salinité, température…), ou pour des motifs technico-économiques (coût du captage disproportionné) peuvent ne pas constituer des masses d’eau.
Compte tenu de sa taille, une masse d’eau pourra présenter une certaine hétérogénéité spatiale tant au niveau de ses caractéristiques hydrogéologiques que de son état qualitatif et quantitatif.
En un point quelconque plusieurs masses d’eau peuvent se superposer. 
La couche PolygMasseDEauSouterraine résulte de l’agglomération en un seul fichier, de l’ensemble des masses d’eau souterraine divisées en multipolygones élémentaires correspondant à chacun de leur niveau de profondeur. La totalité du territoire national est couverte, les polygones se chevauchent. En d’autres termes, si l’on cherche à identifier les masses d’eau présentes en un point du territoire, cette couche pourra rendre 1 à 10 masses d’eau différenciées uniquement par l’ordre de superposition associé.
Conforme au dictionnaire de données SANDRE V1.2, la couche est composée des mêmes attributs que la couche MasseDEauSouterraine avec :
- L’ajout du champ « Niveau » : Niveau de profondeur du multipolygone élémentaire de la masse d’eau souterraine ;
- L’ajout du champ « CdPolygMasseDEauSouterraine » : Code unique du multipolygone élémentaire de la masse d’eau souterraine.";"";"";"Licence Ouverte / Open Licence";"2010-11-30";"2016-11-30";"other";"";False;"2017-07-28T16:07:57.464000";"2020-09-24T06:38:20.253000";"dce,directive-2000-60-ec,directive-cadre-eau,donnees-de-references-referentiels-vocabulaire-controle,donnees-ouvertes,eau-souterraine,eaux-souterraines-nappes-deau,france,hvd,hydrogeologie,martinique,masse-deau,mtq,observation-de-la-terre-et-environnement,politique-de-lenvironnement,regional,vrap,zones-de-gestion-de-restriction-ou-de-reglementation-et-unites-de-declaration";False;6;6;"ogc:wfs,ogc:wms";"CSW-DCAT";"data.ofb.fr";"";"";"";"0.67";0;0;0;"{'2024-08': 0, '2024-09': 0, '2024-10': 0, '2024-11': 0, '2024-12': 0, '2025-01': 0, '2025-02': 0, '2025-03': 0, '2025-04': 0, '2025-05': 0, '2025-06': 0, '2025-07': 0, '2025-08': 0}";0;0;"{'2024-08': 0, '2024-09': 0, '2024-10': 0, '2024-11': 0, '2024-12': 0, '2025-01': 0, '2025-02': 0, '2025-03': 0, '2025-04': 0, '2025-05': 0, '2025-06': 0, '2025-07': 0, '2025-08': 0}";951;1968
